NCT Number,Study Title,Study URL,Acronym,Study Status,Brief Summary,Study Results,Conditions,Interventions,Primary Outcome Measures,Secondary Outcome Measures,Other Outcome Measures,Sponsor,Collaborators,Sex,Age,Phases,Enrollment,Funder Type,Study Type,Study Design,Other IDs,Start Date,Primary Completion Date,Completion Date,First Posted,Results First Posted,Last Update Posted,Locations,Study Documents
NCT02095600,Radiosurgery for Drug Resistant Invalidating Tremor,https://clinicaltrials.gov/study/NCT02095600,DB-SRS,COMPLETED,"Stereotactic lesioning of thalamus and basal ganglia for treatment of tremor is a well-known procedure which, prior to the introduction of deep brain stimulation, or DBS, was usually achieved using stereotactic surgical procedures.

Radiosurgery of invisible targets to treat movement disorders and intractable pain are still the domain of frame-based procedures, due to the need of a solid reference system registered to the anterior commissure-posterior commissure (AC-PC) line, which allows the use of stereotactic atlases.

In this study we want to utilize a mathematical method that uses atlas-derived stereotactic coordinates to perform frameless images-guided radiosurgery of such functional targets Particularly the aim of the present study is to investigate both the efficacy and the safety of the methodology to treat upper limb and hand tremor in elderly or in patients which are not ot susceptible of surgical procedures. For these reasons a dose escalation prospective trial have been designed.",NO,Severe Upper Limb Tremor Refractory to Medical Therapy,RADIATION: Radiosurgical thalamotomy,"Tremor control (improvement in FTMTRS and/or UPDRS motor), Tremor control (improvement in Fahn Tolosa Marin Tremor Rating Scale, FTMTRS, and/or Unified Parkinson's Disease Rating Scale, UPDRS, motor), 2 years","Targeting methodology validation (the lesions position, if present, will be compared to the treatment plan target position, deviations will be registered)., 2 years|The treatment safety will be evaluated. Toxicity will be registered according to NCI-CTCAE v3., The treatment safety will be evaluated. Toxicity will be registered according to National Cancer Institute-Common Terminology Criteria for Adverse Events Version 3,NCI-CTCAE v3., 2 years",,Fondazione I.R.C.C.S. Istituto Neurologico Carlo Besta,,ALL,"ADULT, OLDER_ADULT",NA,6,OTHER,INTERVENTIONAL,Allocation: NA|Intervention Model: SINGLE_GROUP|Masking: NONE|Primary Purpose: TREATMENT,DB-SRS,2011-04,2016-12,2017-07,2014-03-26,,2019-03-20,"Fondazione IRCCS Istituto Neurologico C. Besta, Unit of Radiotherapy, Milan, 20133, Italy",
NCT03305588,RAD 1601: EDGE Radiosurgery for Intractable Essential Tremor and Tremor-Dominant Parkinson's Disease,https://clinicaltrials.gov/study/NCT03305588,,ACTIVE_NOT_RECRUITING,To determine the efficacy of frameless Virtual Cone Radiosurgical Thalamotomy for medically refractory tremor resulting from either Essential Tremor or Tremor-Dominant Parkinson's Disease with the Fahn-Tolosa-Marin Tremor Rating Scale (FTMTRS) in patients who are not candidates for deep brain stimulation (DBS).,NO,Essential Tremor|Parkinson Disease,DEVICE: Unframed Virtual Cone,"Overall tremor reduction proportion evaluated by the Fahn-Tolosa-Marin Tremor Rating Scale (FTMTRS), The Fahn-Tolosa-Marin Tremor Rating Scale evaluation will assess the severity of the patient's tremor and measure the impact on their activities of daily living., From Baseline up to 36 months following completion of radiosurgery","Number of Participants with treatment-related adverse events, Based on the assessments of the patient and the responses provided by the patient in questionnaires, the investigators will assess acute and late neurologic toxicities. All adverse events/toxicities will be assessed with the utilization of CTCAE v.4.0., From Baseline up to 36 months following completion of radiosurgery|Changes in resting-state functional MRI (fMRI) and diffusion tensor patterns associated with Radiosurgical thalamotomy, Changes will be assessed by resting-state functional MRI (fMRI) to see the impact of radiosurgery ablation on brain function or alteration of function of the ventral intermediate nucleus of the thalamus., From Baseline up to 36 months following completion of radiosurgery|Mean of Quality of Life Scores measured by SF-36 questionnaire, Quality of Life (QOL) will be measured by SF-36 questionnaire. This questionnaire consists of 36 questions (items) measuring physical and mental health in relation to 8 health concepts: physical functioning, bodily pain, role of limitations due to physical health problems, role of limitations due to personal or emotional problems, emotional well-being, social functioning, energy/fatigue, and general health perception. All items are scored so that a high score defines a more favorable health state. Each item is scored on a 0 to 100 range so that the lowest and highest possible scores are set at 0 and 100, respectively., From Baseline up to 36 months following completion of radiosurgery|Mean of Quality of Life Scores measured by PROMIS Upper Extremity Questionnaire, PROMIS Upper Extremity questionnaire will assess effect of tremor on one's physical function of upper extremity, as well as, effects on activities of daily living., From Baseline up to 36 months following completion of radiosurgery|Patient Satisfaction Scores, 3 months following the completion of radiosurgery, the patient will be asked the following two questions: 1) Would the participant have the radiosurgery procedure again? 2) Would the participant recommend it to friends and family?, 3 Month Follow-Up Visit|Define Targeting Methods within Thalamus based on Structural and Functional Connectivity, Compare how well the standard MRI conventional thalamotomy targeting technique (based on predetermined atlas coordinates) matches with advanced MRI-based (functional and structural) mapping of the thalamotomy target., From Baseline up to 36 months following completion of radiosurgery|Mean of Quality of Life Scores measured by the Essential Tremor Rating Assessment Scale (TETRAS), TETRAS scale will assess 9 performance items of examination to create a clinical rating scale for essential tremor. Score is 0-4. Zero being no tremor., From Baseline up to 36 months following completion of radiosurgery",,University of Alabama at Birmingham,,ALL,"ADULT, OLDER_ADULT",NA,40,OTHER,INTERVENTIONAL,Allocation: NA|Intervention Model: SINGLE_GROUP|Masking: NONE|Primary Purpose: TREATMENT,IRB-160811009,2017-12-05,2024-12,2025-12,2017-10-10,,2023-08-01,"University of Alabama at Birmingham (UAB) Hazelrig-Salter Radiation Oncology Center, Birmingham, Alabama, 35249, United States",
NCT01364259,A Study of Amifostine for Prevention of Facial Numbness in Radiosurgery Treatment of Trigeminal Neuralgia,https://clinicaltrials.gov/study/NCT01364259,,TERMINATED,"Trigeminal neuralgia or tic douloureux is severe, often debilitating, facial pain that significantly impairs the patient's quality of life and health. Stereotactic radiosurgery has been shown to provide pain relief in majority of patients treated. However, a common side effect of radiosurgery is facial numbness. Our goal is to maximize pain control while minimizing side effects. To this end, the purpose of this study is to evaluate whether adding a drug, amifostine, at the time of radiosurgery will protect patients from facial numbness.",YES,Trigeminal Neuralgia,DRUG: Amifostine|PROCEDURE: CyberKnife stereotactic radiosurgery,"Facial Numbness Following Radiosurgery, Percent of patients with facial numbness following radiosurgery will be determined at one year follow up., 1 year","Pain Relief Following Radiosurgery, Pain improvement as assessed by the Barrow Neurological Institute (BNI) facial pain score from pre-treatment baseline of BNI 3-5 (3-some pain/controlled on medications, 4-some pain/not controlled on medications, 5-severe pain) to BNI 1-2 (1-no pain/ no medication, 2- occasional pain/no medication), 1 year",,Stanford University,,ALL,"ADULT, OLDER_ADULT",PHASE3,17,OTHER,INTERVENTIONAL,Allocation: RANDOMIZED|Intervention Model: PARALLEL|Masking: SINGLE (PARTICIPANT)|Primary Purpose: TREATMENT,IRB-14896|SU-05252011-7806,2008-09,2014-01,2015-01,2011-06-02,2016-12-16,2017-04-04,"Stanford University School of Medicine, Stanford, California, 94305, United States",
NCT02249559,Pilot Study Evaluating Safety of Unilateral Gamma Knife Subthalamotomy for Parkinson's Disease,https://clinicaltrials.gov/study/NCT02249559,GKSTN,TERMINATED,This is a pilot study to evaluate the safety and efficacy of unilateral gamma knife subthalamotomy for Parkinson's disease in patients deemed poor candidates for deep brain stimulation.,NO,Parkinsons Disease,,"Safety of performing GK lesions in the Subthalamic Nucleus (STN) for PD patients, * Safety of GK subthalamotomy in the management of PD as measured by stable findings on neurologic exam at each clinic visit (hemiballismus, dyskinesias, sensory changes) and the absence of Serious Adverse Events (SAE) attributable to treatment.
* Because this study does not have a control group, we will compare the non-inferiority of GK subthalamotomy to published outcomes in PD patients undergoing other forms of management., 12 months","Efficacy of GK subthalamotomy for PD, To be determined by changes in the patient's clinical status and any improvement following the treatment.

* Neurologic function as determined by UPDRS, MMSE, neurologic exam results, CGI assessment and LEDD score.
* Quality of life, as determined by PDQ-39 score and Beck's Depression Inventory (BDI) score., 12 months",,NYU Langone Health,,ALL,OLDER_ADULT,,4,OTHER,OBSERVATIONAL,Observational Model: |Time Perspective: p,14-00902,2014-07,2016-09,2017-09,2014-09-25,,2017-12-06,"NYU Medical Center, New York, New York, 10016, United States",
NCT02585583,Deep Brain Frameless Radiosurgery for Drug Resistant Invalidating Tremor. Dose Escalation Pilot Study,https://clinicaltrials.gov/study/NCT02585583,PRDBRS2,UNKNOWN,"The gamma knife radiosurgical thalamotomy to treat many movement disorders is recently becoming a new and well defined treatment paradigm.

The CyberKnife if compared to the frame-based radiosurgery, is a pain free procedure which offers the advantage of a better patient's compliance by avoiding local anaesthesia and the discomfort due to wearing the frame for the period of time needed for the whole procedure.

Unfortunately the subtle but substantial differences about the 3D dose distribution and the dose fall-off features between GK and CK made mandatory investigations about the effectiveness and the safety when the cyberknife is used.

Particularly the minimum effective and safety dose have to be defined yet A previous study (NCT02095600) failed in demonstrating the efficacy of 75 Gy, 80 Gy, 90 Gy.

The aim of the present study is to investigate about the effectiveness of 100 Gy, 120 Gy, 130 Gy and 140 Gy.

The safety and the targeting methodology will be also in investigated.",NO,"Tremor, Limb",RADIATION: Thalamotomy,"Minimun effective dose (presence/absence of visible MRI thalamotomy), The aim of this study is to define the minimum effective dose to obtain a tremor control, 18 months","Targeting validation (post treatment thalamotomy merge the target plan), Targeting methodology validation (the lesions position, if present, will be compared to the treatment plan target position, deviations will be registered)., 18 months|Toxicity (according to NCI CTCAE v4.0), Number and grade of adverse events, 24 months",,Fondazione I.R.C.C.S. Istituto Neurologico Carlo Besta,,ALL,"ADULT, OLDER_ADULT",NA,8,OTHER,INTERVENTIONAL,Allocation: NA|Intervention Model: SINGLE_GROUP|Masking: NONE|Primary Purpose: TREATMENT,PR DB RS2,2015-05,2021-12,2021-12,2015-10-23,,2020-02-12,"Radiotherapy Unit, Milan, 20133, Italy",
NCT02406105,An Effectiveness and Toxicity of CyberKnife Based Radiosurgery for Parkinson Disease,https://clinicaltrials.gov/study/NCT02406105,,UNKNOWN,Clinical objective of the study is estimation of effectiveness and safety of Cyber Knife based functional radiosurgery for Parkinson disease patients suffering from tremor.,NO,Parkinson Disease,RADIATION: Radiosurgical thalamotomy|DRUG: CyberKnife,"Tremor reduction evaluated using Unified Parkinson's Disease Rating Scale, Tremor reduction will be evaluated using Unified Parkinson's Disease Rating Scale (UDPRS), 1 year","Safety of treatment (evaluated using RTOG/EORTC Acute Radiation Morbidity Scoring Criteria and Late Radiation Morbidity Scoring Schema), Safety of treatment will be evaluated using RTOG/EORTC Acute Radiation Morbidity Scoring Criteria and Late Radiation Morbidity Scoring Schema, 1 year|Evaluation of the value of magnetic resonance spectroscopy as a tool for metabolites proportions changes after PD radiosurgery (spectra of metabolites in irradiated volume), None grading system of serial spectroscopy dedicated for such purpose exists. We will check spectra of metabolites in irradiated volume and proportions between them, trying to form conclusions considering necrosis/gliosis forming., 2 years|Implementation of CyberKnife radiosurgery for Parkinson disease patients not eligible for other treatment modality, 2 years",,Maria Sklodowska-Curie National Research Institute of Oncology,,ALL,"ADULT, OLDER_ADULT",PHASE2,27,OTHER,INTERVENTIONAL,Allocation: NA|Intervention Model: SINGLE_GROUP|Masking: NONE|Primary Purpose: TREATMENT,FSRSPD-COI-03,2015-01,2018-06,2020-12,2015-04-02,,2015-04-02,"Maria Sklodowska-Curie Memorial Cancer Center and Institute of Oncology Gliwice Branch, Gliwice, Wybrzeze AK 15, 44-100, Poland",
