NCT Number,Study Title,Study URL,Acronym,Study Status,Brief Summary,Study Results,Conditions,Interventions,Primary Outcome Measures,Secondary Outcome Measures,Other Outcome Measures,Sponsor,Collaborators,Sex,Age,Phases,Enrollment,Funder Type,Study Type,Study Design,Other IDs,Start Date,Primary Completion Date,Completion Date,First Posted,Results First Posted,Last Update Posted,Locations,Study Documents
NCT00350402,Masked Faces in Parkinson Disease: Mechanism and Treatment,https://clinicaltrials.gov/study/NCT00350402,,COMPLETED,The purpose of this study is to examine the effectiveness of high intensity respiratory muscle strength training in treating blunted facial expression in people with Parkinson disease.,YES,Parkinson's Disease,BEHAVIORAL: Respiratory muscle strength training,"Change in Facial Entropy Score From Baseline [Off Dopamine Medication], Primary outcome is change in entropy score from baseline to immediate completion of 4 week intervention. Entropy is a computer derived index of facial movement that is computed by quantifying changes in pixel intensity as the face moves over a series of video frames. Entropy values range from 0 up to 100. Higher scores reflect greater movement and expressivity (desired). In this condition (""off dopamine), entropy scores were obtained when participants were tested ""off"" their normal dopamine medications. Off-dopamine testing occurred after a 12-hour overnight washout period., Baseline and 4 weeks (i.e., immediate after 4-week treatment)|Change in Facial Entropy Score From Baseline [On Dopamine Medication], Outcome is entropy change from baseline to immediate completion of 4 week intervention when participants remained on their normal dosage of dopamine medication. Entropy is quantitative index of facial movement that is computed from changes in pixel intensity as the face moves. Entropy values range from 0 up to 100. Higher scores reflect greater movement and expressivity. Greater expressivity is desired outcome., Baseline and 4 weeks (i.e., immediate after 4-week intervention)","Change in Parkinson Disease Quality of Life-39 Scale (PDQ-39), The PDQ-39 is a widely used quality of life measure that is specific to Parkinson disease. Total raw score on the PDQ-39 ranges from 0 to 156. Higher scores reflect worse quality of life rating. Total score on PDQ-39 was used to compute pre-post treatment changes., Baseline and 4 weeks (i.e., immediate post-intervention)","Change From Baseline in Maximal Inspiratory Pressure (MIP), The dependent variable is the change in maximal inspiratory pressure (MIP) from baseline to immediate completion of 4-week intervention. MIP refers to how much air pressure force an individual creates by inhaling through the mouth as hard as possible. This was measured over 5-7 trials by placement of lips around a mouthpiece attached to a calibrated fluke digital pressure gauge. From these trials, an average maximum inspiratory pressure (MIP) was computed. This was done at baseline and post-treatment. Greater MIP changes correspond to greater treatment-related effects of exercise., Baseline and 4 weeks (i.e., immediate after 4-week intervention)",University of Florida,National Institute of Neurological Disorders and Stroke (NINDS),ALL,"ADULT, OLDER_ADULT",PHASE2,44,OTHER,INTERVENTIONAL,"Allocation: RANDOMIZED|Intervention Model: PARALLEL|Masking: DOUBLE (PARTICIPANT, INVESTIGATOR)|Primary Purpose: TREATMENT",R01NS050633|R01NS050633,2004-12,2009-11,2009-11,2006-07-10,2012-02-06,2012-04-06,"Cognitive Neuroscience Laboratory, L3-135, McKnight Brain Institute, University of Florida, Gainesville, Florida, 32601, United States",
NCT01258790,Repetitive Transcranial Magnetic Stimulation to Reduce Tics,https://clinicaltrials.gov/study/NCT01258790,,COMPLETED,"Specific Aim1: Using a paradigm of Transcranial Magnetic Stimulation called Continuous Theta Burst Stimulation (cTBS) to reduce tics in Tourette Syndrome subjects

Hypothesis1: cTBS, compared to sham stimulation, will reduce tic severity by at least 25% as measured by the Yale Global Tic Severity Scale

Specific Aim2: Using cTBS to further understand neural correlates of tic generation

Hypothesis2: Functional MRI BOLD signal activation pattern will change after cTBS and this change will correlate with clinical improvement in tic severity",YES,Tourette Syndrome,DEVICE: Sham Repetitive Transcranial Magnetic Stimulation|DEVICE: Active Repetitive Transcranial Magnetic Stimulation,"Yale Global Tic Severity Scale, The tic severity score based on Yale Global Tic Severity Scale ranges from 0 - 50. A person who has no tics would have a score of 0. High score means a person has severe tics., 1 week",,,"Children's Hospital Medical Center, Cincinnati",,ALL,"CHILD, ADULT",NA,12,OTHER,INTERVENTIONAL,"Allocation: RANDOMIZED|Intervention Model: PARALLEL|Masking: DOUBLE (PARTICIPANT, OUTCOMES_ASSESSOR)|Primary Purpose: TREATMENT",IRB #: 2010-2689,2010-11,2012-11,2013-03,2010-12-13,2014-03-25,2014-07-01,"Cincinnati Children's Medical Center, Cincinnati, Ohio, 45229, United States",
NCT01134848,A Study of Serial Magnetic Resonance Cholangiopancreatography (MRCP) Following Morphine-neostigmine and Secretin Provocation in Healthy Volunteers,https://clinicaltrials.gov/study/NCT01134848,,COMPLETED,"The sphincter of Oddi is a circular band of muscle which controls the flow of pancreatic juices and bile into the small intestine. Abnormal function of the Sphincter of Oddi, known as Sphincter of Oddi dysfunction (SOD), can lead to recurrent episodes of abdominal pain. Making a diagnosis of SOD is difficult and is currently achieved using an invasive pressure test. This pressure test is associated with some adverse effects including inflammation of the pancreas gland. We are investigating an alternative test in which medication is given to provoke spasm of the sphincter. Following provocation, blood can be sampled to detect changes in blood composition and changes in sphincter anatomy can be evaluated using specialized imaging techniques.

Our aim is to study and compare the effects of two provocation medications (morphine-prostigmine and secretin) on biliary and pancreatic ductal anatomy, using dynamic serial MRCP in healthy volunteers.

Our hypothesis is that morphine-neostigmine provocation results in greater changes in biliary and pancreatic ductal anatomy when assessed using dynamic serial MRCP.",NO,Sphincter of Oddi Dysfunction,DRUG: Morphine|DRUG: Neostigmine|DRUG: 0.9% saline|DRUG: Secretin|DRUG: 0.9% saline,"Serum amylase (U/L), 0, 60, 120, 180 and 240 minutes|Serum lipase (U/L), 0, 60, 120, 180 and 240 minutes|Liver function tests, 0, 60, 120, 180 and 240 minutes","Pancreatic duct diameter (mm), 0, 5, 30, 60, 90, 120, 150 and 180 minutes|Pancreatic duct length (mm), 0, 5, 30, 60, 90, 120, 150 and 180 minutes|Common bile duct diameter (mm), 0, 5, 30, 60, 90, 120, 150 and 180 minutes|Gallbladder volume (mm3), 0, 5, 30, 60, 90, 120, 150 and 180 minutes",,University of Nottingham,,ALL,"ADULT, OLDER_ADULT",PHASE4,10,OTHER,INTERVENTIONAL,"Allocation: RANDOMIZED|Intervention Model: CROSSOVER|Masking: TRIPLE (PARTICIPANT, INVESTIGATOR, OUTCOMES_ASSESSOR)|Primary Purpose: DIAGNOSTIC",C/10/2007,2009-01,2010-02,2010-02,2010-06-02,,2010-06-02,"University of Nottingham, Nottingham, Nottinghamshire, NG7 2UH, United Kingdom",
NCT03049033,NMT for Parkinson's Disease,https://clinicaltrials.gov/study/NCT03049033,,RECRUITING,"Parkinson's Disease (PD) is defined by characteristic motor symptoms including slow movements, small movements, difficulty with movement initiation and disruptions in timing. Besides gross motor symptoms, fine motor impairments in PD cause difficulties with everyday tasks such as writing, self-care, and fine object manipulation. These activity limitations can lead to disability, social isolation, and a reduced quality of life. In a series of breakthrough studies Michael Thaut and colleagues developed Neurologic Music Therapy (NMT) and found it can address many gross motor impairments and improve gait and balance. Other music therapies such as Music-supported Therapy (MST) have proven motor benefits in stroke patients through movement exercises with musical instruments. However, the pathological basal ganglia (BG) in PD brains leads to a reduced supply of those internally generated movements. In contrast, externally cued movements (eg. via a beat or a rhythm) during NMT sessions are instantaneously entrained to the period of a rhythmic stimulus possibly without involvement of the BG. The underlying idea is that rhythm is the essential component relating music specifically to motor behavior. The mechanism of action is called ""rhythmic entrainment"" where one system's motion or signal frequency entrains the frequency of another system. The effect of NMT on fine motor function has not been investigated yet. Music activities are important in the lives of many older adults. Notably, the use of music has been associated with increased well-being for older adults, as it fosters social connection and mood regulation. Furthermore, many musical activities have limited physical demands, making them attainable for individuals who are living with mobility impairments or other physical restrictions. Based on the literature and the investigators preliminary studies, the investigators propose to test the efficacy of Neurologic Music Therapy in comparison to Music Supported Therapy and Occupational Therapy (OT) as standard of care on adults in the Parkinson's spectrum. The investigators have defined a working plan using different musical instruments and growing tempo to specifically improve fine motor movements.",NO,Parkinson Disease,OTHER: Neurologic Music Therapy|OTHER: Occupational Therapy|OTHER: Music Supported Therapy,"Clinical Outcome: Motor 1 (change in the Grooved Pegboard Test), First motor outcome will be a change in the Grooved Pegboard Test., Baseline and 5 weeks|Quality of Life (QOL) Outcome: QOL 1 (change in the 39-Item Parkinson's Disease), First QOL outcome will be a change in the 39-Item Parkinson's Disease Questionnaire., Baseline and 5 weeks|Mechanistic Outcome: Neurophysiology 1 (change in motor beta and gamma power using Magnetoencephalography), Our first mechanistic outcome will be a change in cortical motor beta and gamma power using Magnetoencephalography., Baseline and 5 weeks|Mechanistic Outcome: Neurophysiology 2 (change in auditory-motor functional connectivity using Magnetoencephalography), Our second neurophysiology outcome will be a change in auditory-motor functional connectivity using Magnetoencephalography, Baseline and 5 weeks","Clinical Outcome: Motor 2 (change in the Unified Parkinson Disease Rating Scale Part III), Secondary motor outcome will be a change in the Unified Parkinson Disease Rating Scale Part III., Baseline and 5 weeks|Clinical Outcome: Motor 3 (change in the Finger-Thumb opposition from the Neurological Evaluation Scale), Secondary motor outcome will be a change in the Finger-Thumb opposition from the Neurological Evaluation Scale., Baseline and 5 weeks|Quality of Life (QOL) Outcome: QOL 2 (change in the Clinical Global Impression - Improvement Scale), Second QOL outcomes will be a change in the Clinical Global Impression - Improvement Scale ., Baseline and 5 weeks|Quality of Life (QOL) Outcome: QOL 3 (change in the Hospital Anxiety and Depression Scale), Second QOL outcomes will be a change in the Hospital Anxiety and Depression Scale., Baseline and 5 weeks",,"University of Colorado, Denver",National Center for Complementary and Integrative Health (NCCIH),ALL,"ADULT, OLDER_ADULT",NA,100,OTHER,INTERVENTIONAL,"Allocation: RANDOMIZED|Intervention Model: PARALLEL|Masking: DOUBLE (INVESTIGATOR, OUTCOMES_ASSESSOR)|Primary Purpose: TREATMENT",16-2308|K01AT009894,2017-04-26,2024-12-31,2025-12-31,2017-02-09,,2024-01-03,"University of Colorado Denver, Aurora, Colorado, 80045, United States",
NCT01919034,Evaluating the Relationship of Morphine Consumption and Pain-related Molecules in Hepatic Surgical Patients,https://clinicaltrials.gov/study/NCT01919034,,COMPLETED,"According to above basic findings, it is important to confirm those results in clinic. In this branch, the investigators will use patient control analgesic (PCA) device to investigate the consumption of morphine for patients undergoing hepatic surgery. Preoperative and postoperative (before and after surgery) blood will be sampling (15cc/time) and y liver tissue (10mm3) will be harvested to measure the expression of above molecules (TM, IL-20, HD). Pain questionnaire will also be applied to evaluate their pain control quality. Certainly, the morphine consumption and results from pain questionnaire will be correlated with the molecule amount to figure out possible relationship between morphine consumption and those molecules.

Patients undergoing abdominal surgery and using morphine pain control analgesia (PCA) device will be involved. Pre- and Post- operative (after anesthesia and at the end of surgery) blood sampling (total 30 ml) plus normal liver tissue (10mm3) e will be harvested. Above protein(TM, IL-20, HD) amount change will be measured (ELISA for TM, IL-20 (serum) or flowcytometry (white cells) for TM, HD, IL-20 expression, stain or blotting for skin tissue). Patients will be included in this branch to check the correlation between morphine consumption and protein expression. Pain questionnaire (BPI, McGill) will be applied for pain evaluation. 2-D gel analysis will also be applied to screen further possible molecules.

Specific aims

1. To investigate the correlation of morphine consumption and the serum amount of IL-20, TM or HD
2. To investigate the relationship between IL-20, TM, HD amount in liver tissue and morphine consumption",NO,Pain|Huntington Disease|Hepatic Surgery,,"consumption of morphine for patients undergoing hepatic surgery, Preoperative and postoperative blood will be sampling and tinny liver tissue (10mm3) will be harvested to correlate their morphine consumption will be evaluated for their pain control quality., 20 months","various pain models of TM in tissues, The investigators will use various pain models to evaluate the expression of TM in tissues. Pre- and Post- operative (after anesthesia and at the end of surgery) blood sampling (total 30 ml) plus normal liver tissue (10mm3) e will be harvested. Above protein(TM, IL-20, HD) amount change will be measured (ELISA for TM, IL-20 (serum) or flowcytometry (white cells) for TM, HD, IL-20 expression, stain or blotting for skin tissue)., 20 months|HD over-expressed mice and pain behavior, The investigators will work on HD over-expressed mice and pain behavior with morphine., 20 months|Change of IL-20 after morphine administration, Interleukin-20 (IL-20) is a proinflammatory cytokine belonging to the IL-10 family. IL-20 is produced by activated keratinocytes and monocytes and transmits an intracellular signal through two distinct cell-surface receptor complexes on keratinocytes and other epithelial cells. IL-20 regulates proliferation and differentiation of keratinocytes during inflammation, particularly inflammation associated with the skin. It is also involved in the pathogenesis of osteoporosis and is a new target to treat this disease., 20 months",,National Cheng-Kung University Hospital,,ALL,"ADULT, OLDER_ADULT",,15,OTHER,OBSERVATIONAL,Observational Model: |Time Perspective: p,B-ER-102-026,2012-04,2012-12,2012-12,2013-08-08,,2018-03-29,"National Cheng Kung University Hospital, Tainan City, Shengli Rd, 701, Taiwan",
NCT01021696,Pain in Patients With Dementia and Behavioural Disturbances,https://clinicaltrials.gov/study/NCT01021696,,COMPLETED,"In nursing homes (NHs) 80% of the patients have dementia, between 60%-80% exhibit behavioural disturbances (BPSD), and more than 60% have pain. Both pain and BPSD is more common in those with severe dementia. Since older persons with dementia have less communicative skills, suffer from more pain and exhibit more agitation, pain may be a contributing factor in these patients. More than 40% of patients with BPSD are treated with neuroleptics despite described side-effects. There is an urgent need to investigate the impact of individual pain management on BPSD in patients with dementia.

It was hypothesized that

* pain increase BPSD in patients with dementia
* individual pain treatment decrease BPSD in patients with dementia",NO,Dementia|Pain|Agitation,DRUG: Paracetamol|DRUG: Morphine|DRUG: Buprenorphine plaster|DRUG: Pregabalin,"Cohen-Mansfield Agitation Inventory - long form (CMAI), CMAI has 29-item (max. score 203) to assess agitated behaviours in NH-patients. A six-point rating scale assesses the frequency with which patients manifest BPSD evaluating 29 agitated behaviours, ranging from never, less than once a week, but still occurring, once or twice a week, several times a week, once or twice a day, several times a day or several times an hour. Items are presented in four factors: I Aggressive behaviour; II Physical non-aggressive behaviour; III Verbally agitated behavior, IV hiding and hoarding. Ratings are based on face-to-face interviews with caregivers., CMAI will be used during the screening/inclusion process, at week 2, 4, 8, and 12.","Neuropsychiatric Inventory - Nursing Home Version (NPI-NH), NPI is a caregiver based interview (10 min.), assessing 10 BPSD and 2 neurovegetative areas with total score and subscales for: delusion, hallucination, agitation, depression, anxiety, disinhibition apathy, irritability, aberrant motor activity, sleep, appetite. Frequency, severity, and caregiver's distress are measured. The NH-version will be used, recently validated in Norwegian (AGS Panel 1998). A higher score reflects increased frequency and severity of the disturbances., NPI will be used during the inclusion process, at week 2, 4, 8, and 12.|Activity of Daily Living function (ADL), ADL assess physical function. Rating includes activities like feeding, moving, personal toilet, and dressing higher values indicating higher levels of activities of daily functioning and independency (Sheikh 1979). The scale includes 10 items (0-20 score). The ADL score is derived from caregiver interview. Administration of the ADL takes approximately 5 minutes., ADL assessment will be used during clinical investigation related to the inclusion prosess and at week 8|Mini Mental State Examination, The MMSE is a 30-point mental status examination scale that enables cut-off differentiation for levels of severity of cognitive impairment (Folstein 1975). Cut point for moderate dementia: \<20. The question consist of several orientation question (10 points), registration and recall task (6), attention task (5), three stage command (3), two naming task (2), repetition task (1), reading comprehension task (1), written sentence (1), and a visual construction (1). The test takes 15 minutes to administer and the patient is asked the questions directly by the examiner., Screening/clinical investigation and week 8|Mobilisation-Observation-Behavior-Intensity-Dementia-2 (MOBID-2) Pain Scale, MOBID-2 Pain Scale is a staff-administered behavioural instrument for assessment pain in older persons with dementia (Husebo 2008a). MOBID-2 is based on patient's pain behaviour in connection with standardised, guided movements of different body part, and pain behaviour related to internal organs, head and skin. Additionally, pain will be registered by pain diagnoses, -etiology, and -duration. The MOBID-2 score is derived from caregiver in a clinical bedside situation during morning care. Administration of the MOBID-2 takes approximately 5 minutes., Screening/clinical investigation, week 2,4,8,12|Functional Assessment Staging (FAST), FAST describes a continuum of seven stages and sub stages from normality to most severe dementia (Hughes 1982). Moderate to severe dementia is consistent with Fast stage of 5 or 6 or 7. Stage 5 is defined as moderately severe cognitive decline, with deficient performance in activities of daily living such as choosing proper clothing and maintaining hygiene. Stage 6 is defined as severe cognitive decline with incontinence and decreased ability to clothe, bathe, toilet oneself, severely limited speech, vocabulary, emotional expression. FAST score is derived from caregiver interview (5 min)., Screening and week 8|Adverse events (AE) and serious adverse event (SAE), Safety and tolerability assessments will consist of monitoring and recording all adverse events (AE) and serious adverse events (SAE) and the regular monitoring of vital signs (BP, puls); AE and SAE registration and report is related to each patient, each medication each centre with reportation to the Norwegian Medicines Agency (study code EUDRACTNR. 2008-007490-20)., week 2,4,8",,University of Bergen,The Research Council of Norway,ALL,OLDER_ADULT,PHASE2|PHASE3,352,OTHER,INTERVENTIONAL,"Allocation: RANDOMIZED|Intervention Model: PARALLEL|Masking: TRIPLE (PARTICIPANT, CARE_PROVIDER, OUTCOMES_ASSESSOR)|Primary Purpose: TREATMENT",2008-007490-20,2009-11,2010-07,2010-10,2009-11-30,,2011-08-10,"Knarvik Nursing Home, Knarvik, Horadland, 5914, Norway|Aastveit Nursing Home, Aastveit, Hordaland, Norway|Dormkirkehjemmet, Bergen, Hordaland, 5018, Norway|Fantoft Omsorgssenter, Bergen, Hordaland, 5020, Norway|Bergen Red Cross Nursing Home, Bergen, Hordaland, 5035, Norway|Solsletten Sykehjem, Bergen, Hordaland, 5164, Norway|Mildeheimen, Bergen, Hordaland, 5259, Norway|Søreide Nursing Home, Bergen, Hordaland, Norway|Lindas bu- og servicecentre, Isdalsto, Hordaland, 5914, Norway|Saata bu og servicecentre, Isdalsto, Hordaland, 5914, Norway|Lyngbøtunet Nursing Home, Laksevag, Hordaland, 5164, Norway|Odinsvei Nursing Home, Nesttun, Hordaland, 5222, Norway|Ovsttunheimen, Nesttun, Hordaland, 5223, Norway|Slaathaug Nursing Home, Hafrsfjord, Rogaland, 4042, Norway|Rovik Nursing Home, Sandnes, Rogaland, 4319, Norway|Sola Nursing Home, Sola, Rogaland, 4097, Norway|Blidensol Nursing Home, Stavanger, Rogaland, Norway|Tasta Nursing Home, Stavanger, Rogaland, Norway",
NCT04784494,MST for Parkinson's Disease,https://clinicaltrials.gov/study/NCT04784494,MST-PD,UNKNOWN,This trial aims to test the feasibility of Magnetic Seizure Therapy (MST) for Depression in patients diagnosed with Parkinson's Disease.,NO,Parkinson Disease|Depression|Movement Disorders|Major Depressive Disorder,DEVICE: Magnetic Seizure Theapy (MagPro XP MST),"Feasibility of using MST to treat dPDT for depression in Parkinson's disease: recruitment, Enrollment will be ≥70% of the planned target., 18 months|Feasibility of using MST to treat dPDT for depression in Parkinson's disease: retention, Retention rate of randomized participants will be ≥70%, 18 months|Feasibility of using MST to treat dPDT for depression in Parkinson's disease: side effects, Drop out rates due to side effects will be ≤10%, 18 months","Efficacy information to plan future definite trial, To obtain mean, SD, and 95% confidence intervals of potential outcome variables for the future RCT to estimate the sample size of the future RCT.

Inventory of Depressive Symptoms (IDS-30), Quick Inventory of Depressive Symptomatology (QIDS), and MDS-Unified Parkinson's Disease Rating Scale (MDS-UPDRS)., 18 months",,University of British Columbia,,ALL,"ADULT, OLDER_ADULT",NA,20,OTHER,INTERVENTIONAL,Allocation: NA|Intervention Model: SINGLE_GROUP|Masking: NONE|Primary Purpose: TREATMENT,H19-01049,2021-09-20,2023-10,2023-12,2021-03-05,,2021-10-07,"University of British Columbia, Vancouver, British Columbia, V6T2A1, Canada",
