NCT Number,Study Title,Study URL,Acronym,Study Status,Brief Summary,Study Results,Conditions,Interventions,Primary Outcome Measures,Secondary Outcome Measures,Other Outcome Measures,Sponsor,Collaborators,Sex,Age,Phases,Enrollment,Funder Type,Study Type,Study Design,Other IDs,Start Date,Primary Completion Date,Completion Date,First Posted,Results First Posted,Last Update Posted,Locations,Study Documents
NCT06167642,Retinal Atrophy and Neurofilament Light Chain in People With Multiple Sclerosis Taking Ofatumumab,https://clinicaltrials.gov/study/NCT06167642,,ENROLLING_BY_INVITATION,"This study aims to assess whether, and the degree to which, ofatumumab modulates or reduces rates of retinal atrophy in people with relapsing-remitting MS (RMS), according to baseline serum neurofilament light chain (sNfL) levels.",NO,"Multiple Sclerosis|Tomography, Optical Coherence|Retinal Degeneration|Visual Acuity",DRUG: Ofatumumab,"Ganglion cell inner plexiform (GCIP) atrophy in RMS relative to HCs, according to baseline sNfL levels, Rates of of GCIP layer thinning (µm/year) will be assessed according to baseline sNfL levels using mixed-effects linear regression models with random subject and eye-specific random intercepts and random slopes in time, using time from baseline OCT visit (in years) as a continuous variable in both unadjusted models (including time, sNfL group and their interaction) and models adjusted for the cross-sectional and longitudinal effects of covariates (age, sex, race, and history of optic neuritis) by including these variables and their respective interactions with time., at least 12 months for up to 2 years","Inner nuclear layer (INL) atrophy in RMS relative to HCs, Rates of INL layer thinning (µm/year) will be assessed according to baseline sNfL levels using mixed-effects linear regression models with random subject and eye-specific random intercepts and random slopes in time, using time from baseline OCT visit (in years) as a continuous variable in both unadjusted models (including time, sNfL group and their interaction) and models adjusted for the cross-sectional and longitudinal effects of covariates (age, sex, race, and history of optic neuritis) by including these variables and their respective interactions with time., at least 12 months for up to 2 years|Outer nuclear layer (ONL) atrophy in RMS relative to HCs, Rates of INL and ONL layer thinning (µm/year) will be assessed according to baseline sNfL levels using mixed-effects linear regression models with random subject and eye-specific random intercepts and random slopes in time, using time from baseline OCT visit (in years) as a continuous variable in both unadjusted models (including time, sNfL group and their interaction) and models adjusted for the cross-sectional and longitudinal effects of covariates (age, sex, race, and history of optic neuritis) by including these variables and their respective interactions with time., at least 12 months for up to 2 years|Differences in the visual function scores, Exploratory analyses within the ofatumumab group will assess changes in visual function scores by baseline sNfL levels utilizing logistic regression., at least 12 months for up to 2 years|Differences in expanded disability status scale (EDSS) scores, Exploratory analyses within the ofatumumab group will assess changes in EDSS scores by baseline sNfL levels utilizing logistic regression., at least 12 months for up to 2 years",,Johns Hopkins University,Novartis,ALL,"ADULT, OLDER_ADULT",,75,OTHER,OBSERVATIONAL,Observational Model: |Time Perspective: p,IRB00347678,2023-05-22,2025-06,2025-06,2023-12-12,,2023-12-12,"Johns Hopkins, Baltimore, Maryland, 21287, United States",
NCT00955877,Extended-release Epidural Morphine for Acute Post-operative Analgesia Following Selective Dorsal Rhizotomy in Children,https://clinicaltrials.gov/study/NCT00955877,,TERMINATED,"The purpose of this proposal is to improve the investigators' current Selective Dorsal Rhizotomy (SDR) analgesia protocol by eliminating or minimizing the use of fentanyl in the post-operative period.

Children undergoing SDR for spastic cerebral palsy have significant post-operative pain. The procedure requires dissection of the lumbar back musculature and removal of the L1 lamina (the bony posterior part of the vertebra). The majority of the operation is intradural, and a water-tight dural closure at the termination of the operation is critical in order to prevent leakage of cerebrospinal fluid (CSF) from the wound. In fact, these children must remain flat on their back for 48 hours to allow the dural incision to heal prior to mobilization. Thus, adequate pain control is essential not only for patient comfort, but also to prevent agitation and additional stress on the dural closure.

Currently, the investigators' patients undergoing SDR are treated for 48 hours with scheduled intravenous (IV) narcotic (continuous fentanyl infusion at 0.5-2.0 μg/kg/hour) in addition to the sedative/muscle relaxant Valium (0.2 mg/kg IV every 4 hours for 24 hours, then every 6 hours for 24 hours). The IV fentanyl, and to a lesser degree Valium, carries a real risk of hypotension and respiratory depression and requires frequent dose adjustments to achieve adequate analgesia.

By improving the current SDR analgesia protocol, the investigators hope to maximize patient safety and comfort while maintaining the effectiveness of the operation by minimizing the risk of CSF leak.",YES,Spastic Cerebral Palsy,DRUG: Extended-release Epidural morphine (EREM) 80|DRUG: Extended-release Epidural Morphine (EREM) 120|DRUG: Control: Saline,"Adequacy of Analgesia as Judged by Age-adjusted Pain Scales, Mean and standard deviation for standardized, age-appropriate pain scales (per patient per day) 48hrs post surgery. As is standard of care at St. Louis Children's Hospital, pain level was scored based on age using the ""Face, Legs, Activity, Cry, Consolability"" (FLACC) for participants aged 0-3, the FACES scale on participants between the age of 3 and 5, numeric pain rating scale (NRS) on participants between the age of 5 and 8 years, or the Individualized Numeric Rating Scale (INRS) for participants greater than or equal to 8 years of age. All four of the scales were ranged from 0-10 scores, with 0 being no pain at all, and 10 being extreme pain. Each patient had two scores given, one at 24hrs and one at 48hrs post surgery. The output was reported as an average of all scores for all patients within each group., 48 hour post-operative period|Quantity of Fentanyl Administered, Mean and standard deviation of total quantity of fentanyl administered (per patient per day) 48hrs post surgery., 48 hour post-operative period","Number of Participants With Respiratory Depression Within 48hrs Post op, Number of participants with respiratory depression within 48hrs post operation, 48 hour post-operative period|Number of Participants With Hemodynamic Instability 48hrs Post op, Number of Participants with Hemodynamic Instability 48hrs post operation, 48 hour post-operative period|Number of Participants With CSF Leaks Within 6 Months Post op., Number of participants with CSF leaks within 6 months post operation., 6 month post-operative period|Number of Participants That Had Urine Retention for 48hrs Post Foley Catheter Removal., Number of participants that had urine retention for 48hrs post foley catheter removal., After the Foley catheter has been removed on post-operative day #1 for a 48 hour follow-up period|Number of Participants With Nausea and/or Vomiting 48hrs Post op., Number of participants with nausea and or vomiting 48hr post surgery, 48 hour post-operative period|Number of Participants With Pruritis Within 48hrs Post op, Number of participants with pruritis within 48hrs post operation, 48 hour post-operative period|Number of Participants That Were Given Codeine 48hr Post Surgery, Number of participants that were given codeine 48hr post surgery, 48hr post surgery|Number of Participants That Were Given Zofran 48hr Post Surgery, Number of participants that were given Zofran 48hr post surgery, 48hr post surgery|Number of Participants That Were Bradycardia Within 48hr Post Surgery, Number of participants that were bradycardia within 48hr post surgery, 48hr post surgery",,Washington University School of Medicine,,ALL,CHILD,NA,13,OTHER,INTERVENTIONAL,"Allocation: RANDOMIZED|Intervention Model: PARALLEL|Masking: QUADRUPLE (PARTICIPANT, CARE_PROVIDER, INVESTIGATOR, OUTCOMES_ASSESSOR)|Primary Purpose: TREATMENT",DeporDur2009,2010-03,2015-01,2015-01,2009-08-10,2018-04-02,2018-07-11,"St. Louis Children's Hospital, Saint Louis, Missouri, 63110, United States",
