NCT Number,Study Title,Study URL,Acronym,Study Status,Brief Summary,Study Results,Conditions,Interventions,Primary Outcome Measures,Secondary Outcome Measures,Other Outcome Measures,Sponsor,Collaborators,Sex,Age,Phases,Enrollment,Funder Type,Study Type,Study Design,Other IDs,Start Date,Primary Completion Date,Completion Date,First Posted,Results First Posted,Last Update Posted,Locations,Study Documents
NCT05808504,Investigation of the Benefits of Electrical Non-invasive Stimulation on Cognitive Symptoms in Parkinson's Disease,https://clinicaltrials.gov/study/NCT05808504,STIMPARK,NOT_YET_RECRUITING,"Parkinson's disease is the second most common neurodegenerative disease after Alzheimer's disease.

It is mostly characterized by the presence of motor difficulties. However, it can also be accompanied by cognitive disorders which have an equally significant impact on the quality of life of patients and which are not relieved by any treatment.

Among the functions affected by Parkinson's disease, inhibition is an essential process for adapting our behaviors in daily life. Inhibition allows us to stop an action that is no longer required or appropriate to the situation in which we find ourselves in. For example, it comes into play when we have to stop at a ""stop"" sign while driving.

Recent studies suggest that it could be possible to improve the functioning of these processes by using non-invasive brain stimulation tools. Transcranial alternating current electrical stimulation has thus showed promising results in improving functions such as working memory. This technique is completely painless and non-invasive and consists in applying an electric current of very low intensity (barely perceptible) at the level of the scalp, using electrodes.

The investigators are conducting a study to test whether transcranial alternating current electrical stimulation could improve the functioning of the inhibition process which is altered in patients. For this, the investigators will measure this process using a task performed on a computer (the Stop Signal Reaction Time Task), as well as brain activity using a method called ""electroencephalography"", before and after stimulation. For this study, the investigators will include 50 patients and 40 healthy participants to investigate the effect of the stimulation on inhibition.",NO,Parkinson Disease,OTHER: Neuropsychological assessment|OTHER: Neurological assessment|OTHER: Cognitive task|PROCEDURE: EEG|PROCEDURE: tACS (real or sham),"Difference in cognitive performance measured by the stop signal reaction time (SSRT) compared between real and sham stimulation conditions, 5 months","The difference in the dynamic changes in functional networks during the task between real and sham stimulation., The difference in the dynamic changes in functional networks during the task between real and sham stimulation measured by the averaged lifespan (in ms) if the networks identified with the weighted phase lag index., 5 months|The difference in network parameters derived from graph theory between real and sham stimulation., The difference in network parameters derived from graph theory between real and sham stimulation. measured by the functions of the brain connectivity toolbox (matlab) : degree distribution, path length, betweenness centrality, clustering coefficient., 5 months|The existence of correlations between the changes in network measures between real and sham stimulation mentioned above and the behavioral differences measured between real and sham stimulation., Correlations will be calculated in R using the spearman rank correlations between (i) changes in network measures between real and sham stimulation : averaged network lifespan, degree distribution, path length, betweenness centrality, clustering coefficient, and (ii) behavioral differences in SSRT (ms)., 5 months",,"Institut National de la Santé Et de la Recherche Médicale, France",,ALL,"ADULT, OLDER_ADULT",NA,90,OTHER_GOV,INTERVENTIONAL,"Allocation: RANDOMIZED|Intervention Model: CROSSOVER|Masking: DOUBLE (PARTICIPANT, CARE_PROVIDER)|Primary Purpose: OTHER",C21-76|2022- A00767-36,2023-04-15,2026-01-15,2026-01-15,2023-04-11,,2023-04-11,"CHU de Rennes, Rennes, France",
NCT04278430,Transcranial Direct Current Stimulation for Attention Deficit,https://clinicaltrials.gov/study/NCT04278430,,COMPLETED,Infantile hemiplegia due to brain injury is associated with poor attention. Left-sided infantile hemiplegia affects the learning and acquisition of new skills. This study is aiming to improve the Selective visual attention (SVA) through transcranial direct current stimulation (tDCS) in children with Left-sided infantile hemiplegia .,NO,Infantile Hemiplegia,DEVICE: transcranial direct current stimulation|DEVICE: Sham tDCS,"The Computerized Stroop Color-Word Test, The Computerized Stroop Color-Word Test consists of two phases.The first phase is the preparation phase, where the children are asked to identify the color of a circle on the monitor (red, blue, green, or yellow) and press the corresponding key on the keyboard using the unaffected side. Scores obtained at this stage were not included in the final results. The second phase is the actual test, which consists of 96 colorful words, divided into 48 correctly matched colorful words and 48 incorrectly matched colorful words. The words that appeared on the computer screen were presented in a randomized sequence. Each word appeared on the computer screen for 2000 ms with an 800-ms interval. The children were asked to identify the color of the words regardless of their meanings., 3 weeks","academic practical test, An academic practical test will be needed to evaluate the improvement in SVA among children. Therefore, a reading comprehension test will be added to the outcome variables. All the three groups performed a reading comprehension test at the baseline, during the 5th and 10th sessions, and during the follow-up period. Two different stories (unread before and equal difficulty) will be selected from their English course and presented to them at the start and following the completion of the 10th session. These stories comprised of between 700 and 1000 words and the time allowed to complete the story was 20 minutes. In the end, the children were asked to answer 10 multiple-choice questions (MCQ) related to the story. Each correct answer will be assigned 1 point., 3 weeks",,Majmaah University,,ALL,CHILD,NA,15,OTHER,INTERVENTIONAL,"Allocation: RANDOMIZED|Intervention Model: PARALLEL|Masking: TRIPLE (PARTICIPANT, CARE_PROVIDER, OUTCOMES_ASSESSOR)|Primary Purpose: TREATMENT",MU-1441-78,2017-01-03,2019-01-14,2019-02-15,2020-02-20,,2020-02-25,,
NCT05621200,Transcranial Alternating Current Stimulation (tACS) in Patients With Ataxia,https://clinicaltrials.gov/study/NCT05621200,SCAtACS,COMPLETED,The aim of the study is to evaluate the effects on motor and cognitive performance of transcranial alternating current stimulation (tACS) compared to transcranial direct current stimulation (tDCS) and placebo stimulation (sham) in patients with neurodegenerative ataxia to identify a possible rehabilitation protocol.,NO,Ataxia|Spinocerebellar Ataxias|Multiple System Atrophy|Ataxia With Oculomotor Apraxia|CANVAS,DEVICE: Transcranial stimulation over the cerebellar hemispheres,"Change in the International Cooperative Ataxia Rating Scale (ICARS) Score From Baseline, International Cooperative Ataxia Rating Scale (ICARS): semi-quantitative 100-point scale, yielding a total score of 0 (no ataxia) to 100 (most severe ataxia)., Baseline (immediately before the intervention) - Immediately after the intervention|Change in the Scale for the Assessment and Rating of Ataxia (SARA) Score From Baseline, Scale for the Assessment and Rating of Ataxia (SARA): 8-item performance based scale, yielding a total score of 0 (no ataxia) to 40 (most severe ataxia)., Baseline (immediately before the intervention) - Immediately after the intervention","Change in Cerebellar Brain Inhibition (CBI) Measurements From Baseline, Cerebellar brain inhibition (CBI) is expressed as motor evoked potential amplitude (average of 10 recordings). Lower values reflect higher inhibition and thus reduced impairment., Baseline (immediately before the intervention) - Immediately after the intervention|Change in Timed Up and Go Test Duration From Baseline, Time (in seconds) that a person takes to rise from a chair, walk three meters, turn around 180 degrees, walk back to the chair, and sit down while turning 180 degrees, assessed with gait sensors., Baseline (immediately before the intervention) - Immediately after the intervention|Change in Walking Cadence From Baseline, Average Left and Right Steps/Minute during a 60 seconds walk, assessed with gait sensors., Baseline (immediately before the intervention) - Immediately after the intervention|Change in 360° Turn From Baseline, Velocity (Number of Degrees/sec) in making a 360° turn, assessed with gait sensors, Baseline (immediately before the intervention) - Immediately after the intervention",,Azienda Socio Sanitaria Territoriale degli Spedali Civili di Brescia,,ALL,"ADULT, OLDER_ADULT",NA,26,OTHER,INTERVENTIONAL,"Allocation: RANDOMIZED|Intervention Model: CROSSOVER|Masking: TRIPLE (PARTICIPANT, CARE_PROVIDER, INVESTIGATOR)|Primary Purpose: TREATMENT",NP4514,2021-01-28,2022-12-10,2022-12-10,2022-11-17,,2022-12-27,"ASST Spedali Civili di Brescia, Brescia, BS, 25123, Italy",
NCT04065022,The Trans-cutaneous Effects on Physiological Tremor Entertainment During tACS,https://clinicaltrials.gov/study/NCT04065022,,COMPLETED,"Transcranial alternating current stimulation (tACS) is a noninvasive neuromodulation method that works by passing alternating electric current between electrodes where at least one of them is attached to the head. This has been shown to have effects on the motor system, cognition and behavior. The exact mechanism by which tACS causes such effects is not fully understood. Some studies suggests a contribution from the stimulated peripheral nerves present in the scalp rather than direct brain effects. To test this hypothesis two arms will be done. First, 12 subjects (arm 1) will be stimulated using focused 4x1 montage with gel-filled cup-electrodes over the motor cortex and the effects will be compared between anesthetized and non-anesthetized scalp. The effects of anesthetizing the scalp will be tested on three different stimulation amplitudes off (0 mA), low (0.5 mA) and high (2.5 mA). Then, 10 subjects (arm 2) will be stimulated over the contralateral arm to exclude any direct brain stimulation effects and to test if peripheral nerve stimulation can entrain the tremor. Three outcome measurements will be measured during the experiments which are: tremor entrainment, sensation intensity and sensation threshold.",NO,"Tremor, Limb",DEVICE: tACS at tremor frequency,"Change in tremor-stimulation phase entrainment- Session 1, phase locking value was calculated between the tremor signal measured using accelerometer and the stimulation signal, During session one of 12 minutes length (6 minutes with stimulation ON and 6 minutes with stimulation OFF)|Change in tremor-stimulation phase entrainment- Session 2, phase locking value was calculated between the tremor signal measured using accelerometer and the stimulation signal, During session two of 12 minutes length (6 minutes with stimulation ON and 6 minutes with stimulation OFF)|Change in tremor-stimulation phase entrainment- Session 3, phase locking value was calculated between the tremor signal measured using accelerometer and the stimulation signal, During session three of 12 minutes length (6 minutes with stimulation ON and 6 minutes with stimulation OFF)","Sensation rating, The subject is asked to rate the sensation intensity during the stimulation at each stimulation amplitude using a visual analog scale from 0 to 10. Zero means the subject doesn't feel the stimulation and the number starts to increase as the sensation perception intensity increases to reach 10 if the subject feels it painful., Measured up to 5 minutes before the start of the stimulation sessions and lasts for 10 seconds of stimulation after which the subject gives the rating|Sensation threshold, Stimulation amplitude at which the subject starts to feel the stimulation. Stimulation starts with 0 mA amplitude and then increased gradually until stimulation is perceived (or reaching maximum amplitude)., Measured 3 minutes before the start of the stimulation sessions and lasts up to 2 minutes. Stimulation at each amplitude lasts for 10 seconds",,KU Leuven,,ALL,"ADULT, OLDER_ADULT",NA,22,OTHER,INTERVENTIONAL,Allocation: RANDOMIZED|Intervention Model: PARALLEL|Masking: SINGLE (OUTCOMES_ASSESSOR)|Primary Purpose: BASIC_SCIENCE,S57869-1,2017-06-20,2018-01-16,2018-01-16,2019-08-22,,2019-08-22,"KU Leuven, Leuven, 3000, Belgium",
NCT05678725,Transcranial Direct/ Alternating Current Stimulation for Parkinson's Disease Treatment,https://clinicaltrials.gov/study/NCT05678725,,COMPLETED,"To investigate the difference in the treatment efficacy between transcranial direct current stimulation and transcranial alternating current stimulation on Parkinson's disease, including the improvements in the motor, cognitive, and underlying neural mechanisms behind differences in efficacy by electroencephalography (EEG).",NO,Parkinson Disease|tACS|tDCS,DEVICE: tACS|DEVICE: tDCS|DEVICE: sham,"the changes in UPDRS III, Unified Parkinson´s Disease Rating Scale Section III-motor is the sum of 18 items, each item contains 0-4 ratings, where 0=normal, 1= slight, 2= mild, 3=moderate, 4=severe., pre-stimulation; post-stimulation (immediate after stimulation）|the changes in MoCA, Montreal Cognitive Assessment is a 30-question test to assess cognitive function. Lower scores mean a worse cognitive status., pre-stimulation; post-stimulation (immediately after stimulation)","simple reaction task, First , there was a fixation sign""+"" appearing on the screen for 0.5 s, then, after 2-5 seconds, a black dot would appear. Participants were instructed to press the space bar as fast as possible when the black dot appears in the center of the screen, to measure simple perception and sustained alertness. The changes in accuracy(ACC), reaction time(RT), and ACC/RT were calculated., pre-stimulation; post-stimulation (immediately after stimulation)|the changes in EEG power, EEG recording by 8 channels EEG device. The EEG power in alpha， beta， delta, and theta bands will be investigated, pre-stimulation; post-stimulation (immediately after stimulation)",,Anhui Medical University,,ALL,"ADULT, OLDER_ADULT",NA,80,OTHER,INTERVENTIONAL,"Allocation: RANDOMIZED|Intervention Model: PARALLEL|Masking: TRIPLE (PARTICIPANT, INVESTIGATOR, OUTCOMES_ASSESSOR)|Primary Purpose: TREATMENT",tAtDComparePD,2022-10-15,2022-12-15,2022-12-15,2023-01-10,,2023-01-10,"Anhui Medical University, Hefei, Anhui, 230032, China",
NCT05557786,Treatment of Transcranial Alternating Current Stimulation（tACS）on Cerebellar Ataxia,https://clinicaltrials.gov/study/NCT05557786,,RECRUITING,"This is a longitudinal, triple-blind, randomized-controlled, prospective observational study assessing patients with cerebellar ataxia, including spinocerebellar ataxia type 3 (SCA3) and multiple system atrophy-cerebellar type (MSA-C), to examine the efficacy, safety, and tolerability of transcranial alternating current stimulation (tACS) for up to 3 months.",NO,Spinocerebellar Ataxia Type 3|Multiple System Atrophy-cerebellar Type,DEVICE: Transcranial Alternating Current Stimulation,"Changes in Ataxia symptoms (Scale for the Assessment and Rating of Ataxia (SARA)), To compare the proportion of patients with SARA improvement (decrease) of at least 1.5 from baseline after 2 weeks, assessing changes in the SARA Score, Baseline - 2 weeks|Changes of Clinical Evaluation from UMSARS (Unified Multiple System Atrophy Rating Scale) (only for MSA-C), UMSARS I: This is an assessment of daily life activities via 12 items scale used to assess language, writing, autonomy, walking, and the presence of possible urinary, sexual, or intestinal disorders. (0=no disorder, 48=severe) UMSARS II: Motor examination based on 14 items that evaluate particular facial expression, oculomotricity, oral expression, tremors, or walking. 0=no disorder, 56=severe disorders.

UMSARS III: Blood pressure and heart rate measurements in lying and standing positions for 10 min every minute.

UMSARS IV: Assessment of the disability from 1 to 5; 1 = completely independent; 5 = totally dependent.

Changes of Clinical Evaluation for UMSARS improvement (decrease) from baseline to 2 weeks., Baseline - 2 weeks","Changes in the International Cooperative Ataxia Rating Scale (ICARS) Score From Baseline, ICARS: semi-quantitative 100-point scale, yielding a total score of 0 (no ataxia) to 100 (most severe ataxia), Baseline - 2 weeks - 1 month - 3 months|Changes in the Scale for the Assessment and Rating of Ataxia (SARA) Score From Baseline, SARA: 8-item performance-based scale, yielding a total score of 0 (no ataxia) to 40 (most severe ataxia), Baseline - 2 weeks - 1 month - 3 months|Changes in the 9 Hole Peg Test (9HPT) Score From Baseline, Three timed trials of 9HPT were performed and averaged (mean values are reported) for each separate hand (dominant and nondominant). The total time to complete the task will be recorded for each trial and each separate hand (dominant and nondominant). Longer times represent greater impairment., Baseline - 2 weeks - 1 month - 3 months|Hand Grip Strength, Baseline - 2 weeks - 1 month - 3 months, This is a basic force measurement of hand grip with a dynamometer. Hand grip strength is measured using the Jamar Grip.|Pittsburgh Sleep Quality Index (PSQI), The PSQI is the most commonly used instrument to assess the subjective sleep quality of adults in clinical and community settings., Baseline - 2 weeks - 1 month - 3 months|Epworth score, The Epworth auto-questionnaire, rated from 0 (better) to 24 (worse), assesses day-time sleepiness., Baseline - 2 weeks - 1 month - 3 months|Montreal Cognitive Assessment (MoCA）, In addressing cognitive screening tools, the MMSE and the MoCA are the most commonly used methods in detecting cognitive impairment detection in both clinical and research settings., Baseline - 2 weeks - 1 month - 3 months|Mini-Mental State Examination (MMSE), In addressing cognitive screening tools, the MMSE and the MoCA are the most commonly used methods in cognitive impairment detection in both clinical and research fields., Baseline - 2 weeks - 1 month - 3 months|Hamilton Anxiety Scale (HAMA), HAMA contains 14 questions; each question includes 5 items. Responses are scored as 0 (never), 1 (mild), 2 (moderate), 3 (severe), or 4 (extremely serious). The total score of HAMA is operationally categorized as follows: no anxiety (score 0-6), mild and moderate anxiety (score 7-13), and severe anxiety (score ≥ 14)., Baseline - 2 weeks - 1 month - 3 months|Hamilton Depression Scale (HAMD), HAMD contains 17 questions; each question includes 5 items. Responses are scored as 0 (never), 1 (mild), 2 (moderate), 3 (severe), or 4 (extremely serious). The total score of HAMD can be classified into normal (score 0-6), mild and moderate (score 7-23), and severe depression (score ≥ 24)., Baseline - 2 weeks - 1 month - 3 months|Changes From Baseline in 5 Level EQ-5D (EQ-5D-5L), The EQ-5D-5L is a standard measure of health-related quality of life. EQ-5D-5L consists of two components: a health state profile and a visual analog scale (VAS). EQ-5D health state profile comprises 5 dimensions: mobility, self-care, usual activities, pain/discomfort, and anxiety/depression. Each dimension has 5 levels: 1=no problems, 2=slight problems, 3=moderate problems, 4=severe problems, and 5=extreme problems. The 5D-5L systems are converted into a single index utility score between 0 to 1, where a higher score indicates a better health state. The VAS records the participant's health on a 0-100 mm VAS scale, with 0 indicating ""the worst health you can imagine"" and 100 indicating ""the best health you can imagine."" Higher scores of EQ-VAS indicate better health., Baseline - 2 weeks - 1 month - 3 months|Multiple System Atrophy Quality of Life (MSA-QoL) Score, The score of other sub-dimension of the MSA Quality of Life scale. The MSA-QoL questionnaire is composed of three different subscales: motor (14 items), non-motor (12 items), and emotional/social (14 items). The response options for each question range from 0 (no problem) to 4 (extreme problem), with higher total scores reflecting more impaired quality of life. The MSA-QoL also includes a visual analog scale (VAS) of how satisfied patients feel (range 0-100, with lower scores indicating a lower quality of life)., Baseline - 2 weeks - 1 month - 3 months|Spatiotemporal dynamic changes measured with electroencephalography (EEG), Changes in spatiotemporal dynamics in different frequency bands (theta, alpha, beta, gamma) will be assessed with high density-EEG after tACS intervention (gamma, sham), Baseline - 2 weeks - 1 month - 3 months|Changes from temporospatial parameters of gait, Gait parameters measured by Multimodal Gait Analysis System. The kinetic and kinematic data of gait will be collected in the gait analysis corridor using two sets of smart insole systems and two sets of gyroscope sensor systems., Baseline-2 weeks - 1 month - 3 months|Changes in Neuroimage changes in Magnetic Resonance Imaging (MRI), Including T1, resting-state functional MRI, and Diffusional Kurtosis Imaging (DKI), Baseline - 2 weeks - 1 month - 3 months",,First Affiliated Hospital of Fujian Medical University,,ALL,"ADULT, OLDER_ADULT",,164,OTHER,OBSERVATIONAL,Observational Model: |Time Perspective: p,"MRCTA, ECFAH of FMU[2022]399",2022-08-01,2022-12-31,2023-03-31,2022-09-28,,2022-10-10,"Department of Neurology, The First Affiliated Hospital Fujian Medical University, Fuzhou, Fujian, 350005, China",
NCT03337334,Effects of High Amplitude and Focused tACS on Entraining Physiological Tremor,https://clinicaltrials.gov/study/NCT03337334,,COMPLETED,"Transcranial alternating current stimulation (tACS) is a noninvasive neuromodulation method that works by passing alternating electric current between electrodes where at least one of them is attached to the head. While tACS applied over the motor cortex at the general applied amplitude (1 mA) and using patch electrodes has been shown to entrain physiological tremor in healthy volunteers, the aim of this study is to test the feasibility of using high-amplitude tACS and to assess the effect of different electrode montages and stimulation sites in entraining physiological tremor. First, 10 subjects (arm 1) will be stimulated with 2 mA current amplitude applied between saline soaked patch square electrodes and comparison will be done between motor cortex stimulation and peripheral cortex stimulation. Then, 10 subjects (arm 2) will be stimulated using focused 4x1 montage with gel-filled cup-electrodes and 5 mA amplitude and comparison will be made between motor cortex and occipital cortex stimulation. Three outcome measurements will be measured during the experiments which are: tremor entrainment, phosphene intensity and phosphene threshold.",NO,"Tremor, Limb",DEVICE: tACS at tremor frequency,"Tremor-stimulation phase entrainment, phase locking value was calculated between the tremor signal measured using accelerometer and the stimulation signal, During the 36 minutes of all sessions (3 sessions each of is 12 minutes)","Phosphene rating, The subject is asked to rate the phosphene intensity during the stimulation using a visual analog scale from 0 to 10. Zero means no phosphene is perceived and the number starts to increase as the phosphene perception intensity increases to reach 10 if the subject observe only a white view, Measured up to 5 minutes before the start of the stimulation sessions and lasts for 10 seconds of stimulation after which the subject gives the rating|Phosphene threshold, Stimulation amplitude at which the subject starts to perceive phosphene. Stimulation starts with 0 mA amplitude and then increased gradually until phosphene is perceived (or reaching maximum amplitude)., Measured 3 minutes before the start of the stimulation sessions and lasts up to 2 minutes. Stimulation at each amplitude lasts for 10 sec.",,KU Leuven,,ALL,"ADULT, OLDER_ADULT",NA,23,OTHER,INTERVENTIONAL,Allocation: RANDOMIZED|Intervention Model: PARALLEL|Masking: SINGLE (OUTCOMES_ASSESSOR)|Primary Purpose: BASIC_SCIENCE,S57869,2016-06,2017-04,2017-04,2017-11-09,,2017-11-09,,"Study Protocol and Statistical Analysis Plan, https://storage.googleapis.com/ctgov2-large-docs/34/NCT03337334/Prot_SAP_000.pdf"
