NCT Number,Study Title,Study URL,Acronym,Study Status,Brief Summary,Study Results,Conditions,Interventions,Primary Outcome Measures,Secondary Outcome Measures,Other Outcome Measures,Sponsor,Collaborators,Sex,Age,Phases,Enrollment,Funder Type,Study Type,Study Design,Other IDs,Start Date,Primary Completion Date,Completion Date,First Posted,Results First Posted,Last Update Posted,Locations,Study Documents
NCT02012647,Subthalamic Deep Brain Stimulation (DBS) in Parkinson's Disease,https://clinicaltrials.gov/study/NCT02012647,,COMPLETED,"The purpose of this study is to examine the brain changes in people with Parkinson's Disease (PD) after they get deep brain stimulation (DBS) surgery, compared with people who do not have Parkinson's Disease. Treatment of Parkinson's disease is often difficult and challenging. Deep brain stimulation is an established surgical treatment that is effective for the treatment of PD, but the details of why it helps are not known. In order to achieve maximum benefits from this treatment, it is important to understand how it changes the brain. Specifically, the investigators will study electrophysiology, which is the study of how the brain conducts electrical messages to the rest of the body. To do this, the investigators will use transcranial magnetic stimulation (TMS), which is a painless and non-invasive procedure. They will also conduct motor physiology experiments of the upper and lower limbs to collect data about skeletal muscle movement. The data from this study will help explain whether the electrical changes in the brain have any relation to the physical benefits patients with Parkinson's Disease sometimes receive from DBS surgery.",NO,Parkinson's Disease,PROCEDURE: Transcranial Magnetic Stimulation (TMS)|PROCEDURE: Motor Physiology Testing,"Motor Cortex Excitability, We will measure Motor Cortex Excitability by examining circuitries of inhibition found in the motor cortex which have a reduced function in Parkinson's Disease., As few as 1 days and up to 4 months","Relation between Unified Parkinson's Disease Rating Scale outcomes and physiological measures, The Unified Parkinson's Disease Rating Scale (UPDRS) is used by neurologists to rate the motor impairment of people with Parkinson's Disease. The rater obtains the score by observation and questioning the participant. Higher scores represent greater impairment and scores range from 0-108.

The data collected from the UPDRS will be compared to physiological data collected with EMG during limb movement tasks. These tasks are used to gather data about skeletal muscle movements. The EMG data will be evaluated individually with an EMG paradigm considering velocity of movement and both antagonist and agonist burst patterns., As few as 2 days and up to 4 months|Transcallosal Pathway Excitability, The investigators will examine the effects of unilateral and bilateral stimulation on the excitability of transcallosal pathway, using specific parameters of Transcranial Magnetic Stimulation (TMS)., As few as 2 days and up to 4 months|Physiological Measures, Physiological data will be collected from healthy controls with EMG during limb movement tasks. These tasks are used to gather data about skeletal muscle movements. The EMG data will be evaluated individually with an EMG paradigm considering velocity of movement and both antagonist and agonist burst patterns., One day",,University of Florida,,ALL,"ADULT, OLDER_ADULT",EARLY_PHASE1,4,OTHER,INTERVENTIONAL,Allocation: NON_RANDOMIZED|Intervention Model: PARALLEL|Masking: NONE|Primary Purpose: OTHER,21-2013|40115065-2,2013-08,2016-03,2016-06,2013-12-16,,2020-09-09,"University of Florida, Gainesville, Florida, 32607, United States",
NCT00625300,Repetitive Transcranial Stimulation (r-TMS) Treatment for Patients With Parkinson's Disease,https://clinicaltrials.gov/study/NCT00625300,r-TMS,COMPLETED,"The purpose of this study is to test the effects of deep rTMS using the novel H-coil on the motor, affective and cognitive deficits in patients with Parkinson's disease (PD) and to establish its safety in this population.",NO,Parkinson's Disease,DEVICE: repetitive transcranial stimulation (r-TMS)|DEVICE: Repetitive transcranial stimulation,"Unified Parkinson Disease Rating Scale (UPDRS)(Motor Part), 10-90 days","Clinical Global Impression of Severity (CGIS), 10-90 days",,Sheba Medical Center,Weizmann Institute of Science,ALL,"ADULT, OLDER_ADULT",PHASE2,20,OTHER_GOV,INTERVENTIONAL,"Allocation: RANDOMIZED|Intervention Model: PARALLEL|Masking: DOUBLE (PARTICIPANT, OUTCOMES_ASSESSOR)|Primary Purpose: TREATMENT",SHEBA-08-4726-OC-CTIL,2008-04,2009-07,2009-07,2008-02-28,,2009-10-20,"Sheba Medical Center, Tel Hashomer, Ramat Gan, 52621, Israel",
NCT05670522,Transcranial Direct Current Stimulation Versus Virtual Reality on Gait in Children With Spastic Diplegia,https://clinicaltrials.gov/study/NCT05670522,,COMPLETED,"Spastic diplegia is the most frequent type of cerebral palsy (CP), and impaired gait is a common sequela of this condition. The investigators compared the effects of two novel research interventions transcranial direct current stimulation (tDCS) and virtual reality (VR) on gait impairments in children with spastic diplegia.

Currently, both tDCS and VR require further investigation to determine their clinical effectiveness for children with CP. Thus, the aim of this study was to compare the effects of tDCS and VR training on spatiotemporal and kinetic gait parameters in children with spastic diplegia, as a supplemental intervention to traditional physical therapy.",NO,Cerebral Palsy,DEVICE: Transcranial direct current stimulation|DEVICE: Virtual reality,"Gait velocity (m/s) (Pre-treatment), Gait velocity was measured using Walkway Pressure Measurement System. This system consists of a digital mat inserted in a wooden walkway, equipped with sensors and a pressure recording system at a sampling resolution up to 185 Hz. A computer with the soft-ware (version 7) and transmission hardware were used to download the data. Three trials were then completed to collect the gait parameters for analysis., baseline|Gait velocity (m/s) (post-treatment), Gait velocity was measured using Walkway Pressure Measurement System. This system consists of a digital mat inserted in a wooden walkway, equipped with sensors and a pressure recording system at a sampling resolution up to 185 Hz. A computer with the soft-ware (version 7) and transmission hardware were used to download the data. Three trials were then completed to collect the gait parameters for analysis., 2 weeks|Gait velocity (m/s) (Follow up), Gait velocity was measured using Walkway Pressure Measurement System. This system consists of a digital mat inserted in a wooden walkway, equipped with sensors and a pressure recording system at a sampling resolution up to 185 Hz. A computer with the soft-ware (version 7) and transmission hardware were used to download the data. Three trials were then completed to collect the gait parameters for analysis., 10 weeks","Cadence (steps/min) (Pre-treatment), Cadence was measured using Walkway Pressure Measurement System. This system consists of a digital mat inserted in a wooden walkway, equipped with sensors and a pressure recording system at a sampling resolution up to 185 Hz. A computer with soft-ware (version 7) and transmission hardware were used to download the data. Three trials were then completed to collect the gait parameters for analysis., Baseline|Cadence (steps/min) (post-treatment), Cadence was measured using Walkway Pressure Measurement System. This system consists of a digital mat inserted in a wooden walkway, equipped with sensors and a pressure recording system at a sampling resolution up to 185 Hz. A computer with soft-ware (version 7) and transmission hardware were used to download the data. Three trials were then completed to collect the gait parameters for analysis., 2 weeks|Cadence (steps/min) (Follow up), Cadence was measured using Walkway Pressure Measurement System. This system consists of a digital mat inserted in a wooden walkway, equipped with sensors and a pressure recording system at a sampling resolution up to 185 Hz. A computer with soft-ware (version 7) and transmission hardware were used to download the data. Three trials were then completed to collect the gait parameters for analysis., 10 weeks|Stance time (s) (Pre-treatment), Stance time was measured using Walkway Pressure Measurement System. This system consists of a digital mat inserted in a wooden walkway, equipped with sensors and a pressure recording system at a sampling resolution up to 185 Hz. A computer with soft-ware (version 7) and transmission hardware were used to download the data. Three trials were then completed to collect the gait parameters for analysis., Baseline|Stance time (s) (post-treatment), Stance time was measured using Walkway Pressure Measurement System. This system consists of a digital mat inserted in a wooden walkway, equipped with sensors and a pressure recording system at a sampling resolution up to 185 Hz. A computer with soft-ware (version 7) and transmission hardware were used to download the data. Three trials were then completed to collect the gait parameters for analysis., 2 weeks|Stance time (s) (Follow up), Stance time was measured using Walkway Pressure Measurement System. This system consists of a digital mat inserted in a wooden walkway, equipped with sensors and a pressure recording system at a sampling resolution up to 185 Hz. A computer with soft-ware (version 7) and transmission hardware were used to download the data. Three trials were then completed to collect the gait parameters for analysis., 10 weeks|Swing time (s) (Pre-treatment), Swing time was measured using Walkway Pressure Measurement System. This system consists of a digital mat inserted in a wooden walkway, equipped with sensors and a pressure recording system at a sampling resolution up to 185 Hz. A computer with soft-ware (version 7) and transmission hardware were used to download the data. Three trials were then completed to collect the gait parameters for analysis., Baseline|Swing time (s) (post-treatment), Swing time was measured using Walkway Pressure Measurement System. This system consists of a digital mat inserted in a wooden walkway, equipped with sensors and a pressure recording system at a sampling resolution up to 185 Hz. A computer with soft-ware (version 7) and transmission hardware were used to download the data. Three trials were then completed to collect the gait parameters for analysis., 2 weeks|Swing time (s) (Follow up), Swing time was measured using Walkway Pressure Measurement System. This system consists of a digital mat inserted in a wooden walkway, equipped with sensors and a pressure recording system at a sampling resolution up to 185 Hz. A computer with soft-ware (version 7) and transmission hardware were used to download the data. Three trials were then completed to collect the gait parameters for analysis., 10 weeks|Step length (cm) (Pre-treatment), Step length was measured using Walkway Pressure Measurement System. This system consists of a digital mat inserted in a wooden walkway, equipped with sensors and a pressure recording system at a sampling resolution up to 185 Hz. A computer with soft-ware (version 7) and transmission hardware were used to download the data. Three trials were then completed to collect the gait parameters for analysis., Baseline|Step length (cm) (post-treatment), Step length was measured using Walkway Pressure Measurement System. This system consists of a digital mat inserted in a wooden walkway, equipped with sensors and a pressure recording system at a sampling resolution up to 185 Hz. A computer with soft-ware (version 7) and transmission hardware were used to download the data. Three trials were then completed to collect the gait parameters for analysis., 2 weeks|Step length (cm) (Follow up), Step length was measured using Walkway Pressure Measurement System. This system consists of a digital mat inserted in a wooden walkway, equipped with sensors and a pressure recording system at a sampling resolution up to 185 Hz. A computer with soft-ware (version 7) and transmission hardware were used to download the data. Three trials were then completed to collect the gait parameters for analysis., 10 weeks|Stride length (cm) (Pre-treatment), Stride length was measured using Walkway Pressure Measurement System. This system consists of a digital mat inserted in a wooden walkway, equipped with sensors and a pressure recording system at a sampling resolution up to 185 Hz. A computer with soft-ware (version 7) and transmission hardware were used to download the data. Three trials were then completed to collect the gait parameters for analysis., Baseline|Stride length (cm) (post-treatment), Stride length was measured using Walkway Pressure Measurement System. This system consists of a digital mat inserted in a wooden walkway, equipped with sensors and a pressure recording system at a sampling resolution up to 185 Hz. A computer with soft-ware (version 7) and transmission hardware were used to download the data. Three trials were then completed to collect the gait parameters for analysis., 2 weeks|Stride length (cm) (Follow up), Stride length was measured using Walkway Pressure Measurement System. This system consists of a digital mat inserted in a wooden walkway, equipped with sensors and a pressure recording system at a sampling resolution up to 185 Hz. A computer with soft-ware (version 7) and transmission hardware were used to download the data. Three trials were then completed to collect the gait parameters for analysis., 10 weeks|Maximum force (kg) (Pre-treatment), Maximum force was measured using Walkway Pressure Measurement System. This system consists of a digital mat inserted in a wooden walkway, equipped with sensors and a pressure recording system at a sampling resolution up to 185 Hz. A computer with soft-ware (version 7) and transmission hardware were used to download the data. Three trials were then completed to collect the gait parameters for analysis., Baseline|Maximum force (kg) (post-treatment), Maximum force was measured using Walkway Pressure Measurement System. This system consists of a digital mat inserted in a wooden walkway, equipped with sensors and a pressure recording system at a sampling resolution up to 185 Hz. A computer with soft-ware (version 7) and transmission hardware were used to download the data. Three trials were then completed to collect the gait parameters for analysis., 2 weeks|Maximum force (kg) (Follow up), Maximum force was measured using Walkway Pressure Measurement System. This system consists of a digital mat inserted in a wooden walkway, equipped with sensors and a pressure recording system at a sampling resolution up to 185 Hz. A computer with soft-ware (version 7) and transmission hardware were used to download the data. Three trials were then completed to collect the gait parameters for analysis., 10 weeks|Maximum peak pressure (N/cm²) (Pre-treatment), Maximum peak pressure was measured using Walkway Pressure Measurement System. This system consists of a digital mat inserted in a wooden walkway, equipped with sensors and a pressure recording system at a sampling resolution up to 185 Hz. A computer with the soft-ware (version 7) and transmission hardware were used to download the data. Three trials were then completed to collect the gait parameters for analysis., Baseline|Maximum peak pressure (N/cm²) (post-treatment), Maximum peak pressure was measured using Walkway Pressure Measurement System. This system consists of a digital mat inserted in a wooden walkway, equipped with sensors and a pressure recording system at a sampling resolution up to 185 Hz. A computer with soft-ware (version 7) and transmission hardware were used to download the data. Three trials were then completed to collect the gait parameters for analysis., 2 weeks|Maximum peak pressure (N/cm²) (Follow up), Maximum peak pressure was measured using Walkway Pressure Measurement System. This system consists of a digital mat inserted in a wooden walkway, equipped with sensors and a pressure recording system at a sampling resolution up to 185 Hz. A computer with soft-ware (version 7) and transmission hardware were used to download the data. Three trials were then completed to collect the gait parameters for analysis., 10 weeks",,Beni-Suef University,Shirley Ryan AbilityLab|Cairo University,ALL,CHILD,NA,40,OTHER,INTERVENTIONAL,Allocation: RANDOMIZED|Intervention Model: PARALLEL|Masking: NONE|Primary Purpose: TREATMENT,tDCS verus VR,2020-11-11,2021-08-14,2021-08-14,2023-01-04,,2023-01-11,"outpatient clinic run by the faculty of physical therapy at Cairo University, Giza, 12624, Egypt",
NCT05537597,Repetitive Transcranial Magnetic Stimulation for Musculoskeletal Pain in Patients With Parkinson's Disease,https://clinicaltrials.gov/study/NCT05537597,,NOT_YET_RECRUITING,"Pain is an increasingly recognized non-motor symptom of Parkinson's disease (PD), with significant prevalence and negative impact on the quality of life of patients.

Repetitive transcranial magnetic stimulation (rTMS) of the primary motor cortex（M1）has been proposed to provide definite analgesic effect for pain syndromes. However, very few placebo-controlled studies have been performed specifically to relieve pain in PD. What's more, based on behavioral measures alone, it is impossible to reveal the full network dynamics reflecting the impact of TMS.

Electroencephalography (EEG), with high temporal resolution, records signal that its origin in electrical neural activity, which makes it suitable for measuring TMS-evoked activation. By recording the TMS induced neuronal activation directly from the cortex, TMS-EEG provides information on the excitability, effective connectivity of cortical area, thus exploring cortical network properties in different functional brain states. In addition, the use of EEG offers great prospects as a tool to select the right patients in order to achieve adequate, long-term pain relief.

Besides assessing the efficacy and safety of high-frequency neuronavigated M1-rTMS in PD patients with musculoskeletal pain, the objective of this study additionally aimed to characterize cortical activation behind pain relief. Influence on motor and other non-motor symptoms after rTMS were also investigated.",NO,Parkinson's Disease|Musculoskeletal Pain|Repetitive Transcranial Magnetic Stimulation|Primary Motor Cortex|Electroencephalography|Neuromodulation,PROCEDURE: active M1-rTMS|PROCEDURE: sham rTMS,"Change from baseline over 2 months (group by time interaction) in KPPS, King's PD Pain Scale (KPPS) includes 14 items rating the severity and frequency of pain, each item scored by severity (0-3) multiplied by frequency (0-4), resulting in a subscore of 0 to 12, with a total possible score range from 0 to 168., before the first rTMS session (day 1), after rTMS therapy at day8、1month、2month|Change from baseline over 2 months (group by time interaction) in MKPPS, Modified King's PD Pain Scale (MKPPS)，the modified version which is more suitable for Chinese people, combined with Ford's pain subtypes basing on the original. It covers five main domains, including 16 items, each item scored by severity (0-3) multiplied by frequency (0-4), resulting in a total possible score range from 0 to 192., before the first rTMS session (day 1), after rTMS therapy at day8、1month、2month|Change in pain intensity scores (VAS), VAS, a 0-10 numeric rating scale with 0= no pain and 10=maximal pain, before the first rTMS session (day 1), after rTMS therapy at day8、1month、2month|Adverse event, Any adverse events occurred and the reasons leading to treatment discontinuation will be recorded. The severity and relevance will be rated as mild, moderate or serious by investigators., through study completion, an average of 2 month","Changes in resting-state EEG oscillations, During EEG recordings, participants will sit alone in a quiet room and be requested to minimize any other body movements, mostly with eyes closed.

We will use a TMS-compatible EEG amplifier (neuracle, changzhou, China) and a cap (Greentek, Wuhan, China) providing 64 TMS-compatible coated-electrodes with positions of the international 10/20 system.

The signals recorded will be digitized at a sampling rate of 1kHz. Skin/electrode impedance will be maintained below 10KΩ. The EEG recording protocol consists of a 5-min resting-state paradigm without any task involvement., before the first rTMS session (day 1), after rTMS therapy (day8)|Changes in Resting-State EEG Functional Connectivity, The functional connectivity of the identified brain region showing significant difference of cortical oscillations will be further investigated., before the first rTMS session (day 1), after rTMS therapy (day8)|Alterations of TMS-elicited evoked potentialspotentials, Single-pulse TMS of the M1 will be performed during EEG recording by means of a figure-of-eight coil oriented to elicit posterolateral-anteromedial current flow in the brain. The signal was sampled at 16 kHz. Participants will wear inserted earplugs to avoid signals contamination by the click associated with the TMS discharge.

the interval of each sTMS will be set at 4 seconds to avoid habituation with repeated stimulation.

Each participant will undergo a 20-min session about 120 TMS trials at intensity of 120%RMT., before the first rTMS session (day 1), after rTMS therapy (day8)|Changes in PD-Motor Symptoms Scale total score, The participants will be evaluated in their ""ON"" medication states. The scales used to assess motor symptoms are parts III (ranging from 0 to 132) and IV (ranging from 0 to 24) of the MDS-Unified PD Rating Scale (MDS-UPDRS), with higher scores indicating more severe symptoms., before the first rTMS session (day 1), after rTMS therapy at day8、1month、2month|Changes in PD-Non-Motor Symptoms Scale total score, The participants will be evaluated in their ""ON"" medication states. The scales used to assess non-motor symptoms included parts I (ranging from 0 to 52) and II (ranging from 0 to 52) of the MDS-UPDRS, with higher scores indicating more severe symptoms., before the first rTMS session (day 1), after rTMS therapy at day8、1month、2month|Changes in PD depression score, The depression score (ranging from 0 to 76 with higher scores indicating more severe depression) from the 24 items Hamilton Depression Scale (HAMD)., before the first rTMS session (day 1), after rTMS therapy at day8、1month、2month|Changes in PD anxiety score, The anxiety score (ranging from 0 to 60 with higher scores indicating more severe anxiety) from the 14 items Hamilton Anxiety Scale (HAMA)., before the first rTMS session (day 1), after rTMS therapy at day8、1month、2month|Changes in PD autonomic Symptoms score, The Scale for Outcomes in Parkinson's disease for Autonomic Symptoms (SCOUP-AUT, maximal score 67, with higher scores indicating higher autonomic nervous system dysfunction)., before the first rTMS session (day 1), after rTMS therapy at day8、1month、2month|Changes in PD sleep problem score, The sleep problem index (from 0 to 68 with higher scores indicating more severe sleep problem) from the PD Sleep Scale-2 (PDSS-2)., before the first rTMS session (day 1), after rTMS therapy at day8、1month、2month|Changes in PD daytime sleepiness score, The daytime sleepiness will be assessed by the Epworth Sleeping Scale (ESS), maximal score 24, with higher scores indicating more severe symptoms., before the first rTMS session (day 1), after rTMS therapy at day8、1month、2month|Changes in PD quality of life score, We will also assess change in quality of life from the Parkinson's Disease Questionnaire-39 (PDQ-39), ranging from 0 to 156 with higher scores indicating more serious influence., before the first rTMS session (day 1), after rTMS therapy at day8、1month、2month",,Second Affiliated Hospital of Soochow University,,ALL,"ADULT, OLDER_ADULT",NA,40,OTHER,INTERVENTIONAL,"Allocation: RANDOMIZED|Intervention Model: PARALLEL|Masking: TRIPLE (PARTICIPANT, CARE_PROVIDER, OUTCOMES_ASSESSOR)|Primary Purpose: TREATMENT",JD-LK-2021-132-01,2023-01-01,2025-02,2025-05,2022-09-13,,2022-12-08,"Department of Neurology, Second Affiliated Hospital of Soochow University, Suzhou, Jiangsu, 215004, China",
