NCT Number,Study Title,Study URL,Acronym,Study Status,Brief Summary,Study Results,Conditions,Interventions,Primary Outcome Measures,Secondary Outcome Measures,Other Outcome Measures,Sponsor,Collaborators,Sex,Age,Phases,Enrollment,Funder Type,Study Type,Study Design,Other IDs,Start Date,Primary Completion Date,Completion Date,First Posted,Results First Posted,Last Update Posted,Locations,Study Documents
NCT02180139,tDCS in Cervical Dystonia,https://clinicaltrials.gov/study/NCT02180139,,WITHDRAWN,"Dystonia is a devastating disorder defined by involuntary, sustained muscle contractions or abnormal postures that can affect any part of the body. Cervical dystonia (CD) is the most pervasive form of dystonia affecting 60-90,000 individuals in the United States alone and is characterized by involuntary twisting of the neck. The symptoms of CD are disabling, disfiguring, painful, and have a strongly negative impact on quality of life, including social withdrawal and depression. At present, there is no treatment that has been shown to have long term benefit in CD. Standard of care (SOC) is botulinum toxin, which temporarily paralyzes affected muscles, resulting in reduced muscle spasms. This treatment has many undesirable side effects, variable effectiveness, is expensive, and must be repeated every 3 months throughout the lifespan. Physical therapy based treatments aimed at retraining posture or stretching dystonic muscles are largely ineffective and not typically delivered as a part of standard of care. There is an urgent need for novel and effective therapies. Emerging technologies, specifically non-invasive brain stimulation (NBS), have demonstrated compelling evidence to make a meaningful impact in the lives of people with CD. In this study, individuals with cervical dystonia will be randomly assigned to receive tDCS for 15 minutes daily for 4 days in 1 of 4 stimulation location groups.

Hypothesis 1: One location of stimulation will result in clear benefit with at least 1 standard deviation (SD) improvement in the CDQ-24, the primary outcome measure, at 1-week follow-up.

Hypothesis 2: The cortical silent period will be the most sensitive measure investigated and will demonstrate significant increase in inhibition as determined by an elongation of silent period in the affected upper trapezius muscle.

Hypothesis 3: The stimulation location determined to be most effective in Objective 1 will produce the greatest physiologic change in inhibition increase.

Hypothesis 4: The hypothesis for this aim is if certain characteristics can predict response to treatment, a strong association will be seen between baseline measure(s) and the primary outcome measure. A thorough assessment of characteristics including: age, sex, duration of symptoms, genotyping for two specific polymorphisms, botulinum toxin history, baseline measures of outcome variables, measures of brain excitability, and genetic testing will predict response.",NO,Cervical Dystonia,DEVICE: transcranial direct current stimulation,"Cervical Dystonia Questionnaire (CDQ-24), This primary outcome was selected because it is a patient-rated, disease-specific assessment of quality of life, which we feel should be the primary issue of concern., up to Day 6","Toronto Western Spasmodic Torticollis Rating Scale (TWSTRS), Toronto Western Spasmodic Torticollis Rating Scale is an outcome measure used to rate severity, disability and pain in CD. TWSTRS utilizes three sub-scores of physician-based severity (0-35), patient-based disability (0-30) and pain (0-20) with higher scores indicating greater severity of symptoms. Inter-observer reliability is excellent (rs=99) and good for disability and pain measurements (r˃0.88). The global severity scale was moderate (rs=0.63). TWSTRS exam will be videotaped for posthoc assessment by investigator blinded to group and testing period., Day 1, Day 5, Day 6|Visual Analog Scale (VAS), At the end of each intervention session participants will be asked to rate the ease of movement and perceived pain during cervical rotation in the contralateral direction to their head turn using VAS for self-assessment., Day 1, Day 5, Day 6|Cortical Excitability as measured by transcranial magnetic stimulation, Single and paired pulse testing to assess GABAergic and glutaminergic network function, Day 1, Day 5, Day 6","Adverse reactions, Adverse reactions will be recorded using established reporting forms., Day 1, Day 2, Day 3, Day 4 (all days with intervention)|Genetic Testing, At the last session, a saliva sample will be collected for genetic screening for BDNF and apolipoprotein E4 polymorphisms. We will collect approximately 2 ml (less than one-half teaspoon) of saliva by asking the subject to spit into a tube. It may take up to 30 minutes to provide a saliva sample, however, most people typically require less time (approximately 5 minutes). Collection of saliva using Oragene Discover is non-invasive and there are no anticipated personal risks of injury., Day 6",University of Minnesota,,ALL,"ADULT, OLDER_ADULT",NA,0,OTHER,INTERVENTIONAL,Allocation: RANDOMIZED|Intervention Model: PARALLEL|Masking: SINGLE (PARTICIPANT)|Primary Purpose: TREATMENT,TDCS-2014,2017-09,2017-09,2017-12,2014-07-02,,2017-10-03,"University of Minnesota, Minneapolis, Minnesota, 55455, United States",
NCT03582891,The Motor Network in Parkinson's Disease and Dystonia: Mechanisms of Therapy,https://clinicaltrials.gov/study/NCT03582891,,ACTIVE_NOT_RECRUITING,"This is an exploratory pilot study to identify neural correlates of specific motor signs in Parkinson's disease (PD) and dystonia, using a novel totally implanted neural interface that senses brain activity as well as delivering therapeutic stimulation. Parkinson's disease and isolated dystonia patients will be implanted unilaterally or bilaterally with a totally internalized bidirectional neural interface, Medtronic Summit RC+S.

This study includes three populations: ten PD patients undergoing deep brain stimulation in the subthalamic nucleus (STN), ten PD patients with a globus pallidus (GPi) target and five dystonia patients. All groups will test a variety of strategies for feedback-controlled deep brain stimulation, and all patients will undergo a blinded, small pilot clinical trial of closed-loop stimulation for thirty days.",NO,Parkinson Disease|Dystonia,DEVICE: Summit RC+S for Motor|DIAGNOSTIC_TEST: 8-week pilot trial of Closed-loop vs. Open-loop Stimulation|DEVICE: Summit RC+S for Sleep,"Duration of 'on' stimulation time without dyskinesia from motor diaries in adaptive compared to standard open loop stimulation. (Parkinson's disease patients), Duration of 'on' stimulation time without dyskinesia in adaptive compared to standard open loop stimulation determined from the patients' motor diaries. The self-report motor diary is a validated method to capture this information. Every half-hour, patients indicate in this diary which of 4 categories (on, on with troubling dyskinesia, off, or asleep) best reflected their predominant symptoms for the prior 30 minutes. Patients will complete this diary for 3 consecutive days. The total time spent in the 'on' state without troubling dyskinesia will then be summed and averaged over 3 days for all three conditions (baseline, open-loop stimulation and closed-loop stimulation)., Comparison will use data from the testing of open and closed-loop stimulation during chronic adaptive DBS testing at home.|The Burke-Fahn-Marsden Dystonia Rating Scale-Movement aDBS testing compared to pre-operative baseline(Dystonia Patients), This scales evaluates dystonia in nine body areas, including eyes, mouth, speech and swallowing, neck, trunk, and right and left arm and leg. The maximal total score is 120 - a higher score means worsening symptoms. Investigators will compare the dystonia symptoms and functional disability during adaptive stimulation compared to preoperative baseline., Comparison will use data from the testing of open and closed-loop stimulation during chronic adaptive DBS testing at home.|Toronto Western Spasmodic Torticollis Rating Scale during aDBS testing compared to pre-operative baseline (Dystonia Patients), This is a standardized scale to measure the severity, disability, and pain associated with cervical dystonia. The motor severity subscale consists of 10 items, with variable scaling and weighting. It also includes a disability scale with six items,and a pain scale with three items. The total score is the sum of each of the subscales. A higher score indicates greater disability., Comparison will use data from the testing of open and closed-loop stimulation during chronic adaptive DBS testing at home.|Karolinska Sleepiness Scale, This is a standardized scale for measuring sleepiness, Through study completion, up to 4 years|Psychomotor vigilance task (PVT), This is a standardized behavioral task for measure alertness and attention, Through study completion, up to 4 years|Positive and Negative Affect Schedule (PANAS-SF), This is a standardized mood questionnaire, Through study completion, up to 4 years","The Unified Parkinsons Disease Rating Scale (UPDRS) III scores off of medication in adaptive compared to standard open-loop stimulation. (Parkinson's disease patients), The UPDRS III is a motor rating scale. Investigators will compare the severity motor symptoms while the patient is off of Parkinsoniae (UPDRS) III scores off of medication in adaptive compared to standard open-loop stimulation. (Parkinson's disease patients)n medications in conventional (open-loop) versus adaptive (closed-loop) DBS., Comparison will use data from the testing of open and closed-loop stimulation during chronic adaptive DBS testing at home.|Schwab England scale in adaptive compared to standard open loop stimulation. (Parkinson's disease patients), This scale estimates the abilities of individuals living with Parkinson's Disease relative to a completely independent situation. Investigators will use it to compare the abilities of daily living in subjects during the open-loop and adaptive stimulation trial., Comparison will use data from the testing of open and closed-loop stimulation during chronic adaptive DBS testing at home.|Hoehn and Yahr Staging in the medication 'on' state in adaptive compared to standard open loop stimulation. (Parkinson's disease patients), The Hoehn and Yahr scale are used to describe the progression of Parkinson's disease based upon the level of motor impairment. This scale only includes one score ranging from 1 to 5 where a higher score indicates a higher level of motor impairment. Investigators will compare the level of disease progression between the open-loop and adaptive stimulation conditions., Comparison will use data from the testing of open and closed-loop stimulation during chronic adaptive DBS testing at home.|The patient' quality of life report (PDQ-39) in adaptive compared to standard open loop stimulation. The PDQ39 yields a score between 0 to 100, where a higher score indicates more health problems. (Parkinson's disease patients), The PDQ 39 questionnaire has 39 questions to assess the patient's life quality including mobility, emotional state, and bodily comfort. Investigators will make a comparison of patients' life quality of life between open-loop and adaptive stimulation., Comparison will use data from the testing of open and closed-loop stimulation during chronic adaptive DBS testing at home.|Patient's Global Impression of Change (PGIC) in adaptive compared to standard open loop stimulation. (Parkinson's disease patients), Patient Global Impression of Changes measures the self-reported level of overall improvement (motor and non-motor symptoms) in a patient on a 1-7 scale. A one indicates no change and a 7 is the greatest level of improvement., Comparison will use data from the testing of open and closed-loop stimulation during chronic adaptive DBS testing at home.|Total Electric Energy Delivered (TEED) by the pulse generator in adaptive compared to standard open loop stimulation. (all patients), Investigators will compare the total charge delivered by the pulse generator between open-loop and adaptive stimulation to determine if there is a potential energy savings., Comparison will use data from the testing of open and closed-loop stimulation during chronic adaptive DBS testing at home.|Short form 36 Quality of Life measure (Dystonia Patients), The SF-36 is a measure of self-reported health status which is scored on a 0-100 scale. The lower the score the more disability a patient experiences., Comparison will use data from the testing of open and closed-loop stimulation during chronic adaptive DBS testing at home.|Patient Global Impression of Change (Dystonia Patients), Patient Global Impression of Changes measures the self-reported level of overall improvement (motor and non-motor symptoms) in a patient on a 1-7 scale. A one indicates no change and a 7 is the greatest level of improvement., Comparison will use data from the testing of open and closed-loop stimulation during chronic adaptive DBS testing at home.|Resting state EEG Recording, Resting state cortical power will be analyzed as a surrogate marker of alertness, Through study completion, up to 4 years",,"University of California, San Francisco",,ALL,"ADULT, OLDER_ADULT",NA,25,OTHER,INTERVENTIONAL,"Allocation: RANDOMIZED|Intervention Model: CROSSOVER|Masking: DOUBLE (PARTICIPANT, OUTCOMES_ASSESSOR)|Primary Purpose: TREATMENT",UCSF Summit RC+S,2018-10-01,2025-07-01,2028-03,2018-07-11,,2024-01-23,"University of California at San Francisco, San Francisco, California, 94115, United States",
NCT03663179,Transcranial Magnetic Stimulation for Attention Deficit/Hyperactivity Disorder (ADHD),https://clinicaltrials.gov/study/NCT03663179,,COMPLETED,This study will test the effects of transcranial magnetic stimulation (TMS) on clinical measures of ADHD symptoms.,YES,Attention Deficit Disorder With Hyperactivity (ADHD),DEVICE: Transcranial Magnetic Stimulation (TMS)|DEVICE: Sham Transcranial Magnetic Stimulation (Sham TMS),"Change in Performance on Conners Adult ADHD Rating Scale - Self-Report: Long Version (ADHD Symptoms), ADHD symptoms will be assessed using the well-validated Conners Adult ADHD Rating Scale - Self-Report: Long Version (CAARS-S:L). The CAARS-S:L is a 66-item rating scale designed to assess ADHD symptoms in adults. The scale contains multiple subscales to assess Diagnostic and Statistical Manual of Mental Disorders 4th edition (DSM-IV) specified ADHD criteria as well as other facets of ADHD such as inattention/memory problems, hyperactivity/restlessness, impulsivity/emotionality, and problems with self-concept. Subscale results are converted to T-scores (range: 25-90), where 50 is the standardized population mean and every 10 points indicates one standard deviation from the mean. Higher values generally indicate more difficulties with ADHD symptoms. This measure will be administered at baseline at at the end of 4 weeks of treatment. The primary outcome will be the change from baseline to week 4., Baseline and week 4","Change in Performance on Conners Continuous Performance Task (Sustained Attention), The Conners Continuous Performance Task (Conners CPT) will be administered and baseline and weekly during the treatment period to assess sustained attention. In this task, participants are shown a series of letters on a computer screen and are asked to press the spacebar in response to all letters except for the letter X. The primary outcome for the Conners CPT is the change in number of commission errors (e.g., false positives) from baseline to week 4., Baseline and week 4",,University of Pennsylvania,,ALL,"ADULT, OLDER_ADULT",NA,32,OTHER,INTERVENTIONAL,"Allocation: RANDOMIZED|Intervention Model: PARALLEL|Masking: TRIPLE (PARTICIPANT, CARE_PROVIDER, OUTCOMES_ASSESSOR)|Primary Purpose: TREATMENT",826586,2017-01,2019-03-31,2020-01-01,2018-09-10,2019-09-09,2022-08-05,"University of Pennsylvania, Philadelphia, Pennsylvania, 19104, United States","Study Protocol and Statistical Analysis Plan, https://storage.googleapis.com/ctgov2-large-docs/79/NCT03663179/Prot_SAP_000.pdf"
NCT04606979,tDCS of the Primary Motor Cortex to Improve Implicit Motor Sequence Learning in Parkinson's Disease,https://clinicaltrials.gov/study/NCT04606979,,ACTIVE_NOT_RECRUITING,"Implicit motor sequence learning (IMSL) is a form of cognitive function that is known to be directly associated with impaired motor function in Parkinson's disease (PD). Research in healthy young participants shows the potential for transcranial direct current stimulation (tDCS), a non-invasive brain stimulation technique, over the primary motor cortex (M1) to enhance IMSL. tDCS has direct effects on the underlying cortex, but also induces distant (basal ganglia) network effects - hence its potential value in PD, a prime model of basal ganglia dysfunction. To date, however, only null-effects have been reported in persons with PD. In the present study, the investigators will investigate the potential of tDCS delivered over M1 to enhance IMSL, as measured by the Serial Reaction Time task, in persons with PD. The investigators will determine immediate effects that may occur concurrently with the application of tDCS but also short-term (five minutes post-tDCS) and long-term (one week post-tDCS) consolidation effects, as previous studies suggest that tDCS exerts its beneficial effects on IMSL in a consolidation phase rather than in an acquisition phase. Establishing possible consolidation effects is of a particular interest, as long-term effects are vital for the successful functional rehabilitation of persons with PD.",NO,Parkinson Disease|Parkinson|Healthy,DEVICE: 1x1 Low Intensity Transcranial Direct Current Stimulation (tDCS),"Serial Reaction Time task: Sequence-Specific Learning Effect (during and following active tDCS), The Serial Reaction Time task (SRT-task) will be employed, using E-Prime® software. In a typical SRT task, a target (e.g. black dot) is presented in one of four horizontal locations on a computer screen. Participants are asked to react to the target location by pressing a spatially compatible response key. They are not informed that the order of target locations follows a sequence predetermined by the experimenter. Participants are trained on the sequence in several blocks of trials, e.g.: 7 blocks of 100 trials. Typically, reaction times (RTs) decrease with practice, which is referred to as a general learning effect and constitutes the non-sequence-specific learning component of IMSL. Crucially, RTs increase when the sequence is inconspicuously replaced by a random sequence and decrease again when the predetermined sequence is reintroduced. The latter is referred to as the sequence-specific learning effect and is calculated by subtracting the mean RTs of the adjacent sequel blocks., Changes in Sequence-Specific Learning Effect will be assessed between: (baseline) during active tDCS; (short-term) 5-minutes post active tDCS; (long-term) 1 week post active tDCS|Serial Reaction Time task: Sequence-Specific Learning Effect (during and following sham tDCS), The Serial Reaction Time task (SRT-task) will be employed, using E-Prime® software. In a typical SRT task, a target (e.g. black dot) is presented in one of four horizontal locations on a computer screen. Participants are asked to react to the target location by pressing a spatially compatible response key. They are not informed that the order of target locations follows a sequence predetermined by the experimenter. Participants are trained on the sequence in several blocks of trials, e.g.: 7 blocks of 100 trials. Typically, reaction times (RTs) decrease with practice, which is referred to as a general learning effect and constitutes the non-sequence-specific learning component of IMSL. Crucially, RTs increase when the sequence is inconspicuously replaced by a random sequence and decrease again when the predetermined sequence is reintroduced. The latter is referred to as the sequence-specific learning effect and is calculated by subtracting the mean RTs of the adjacent sequel blocks., Changes in Sequence-Specific Learning Effect will be assessed between: (baseline) during sham tDCS; (short-term) 5-minutes post sham tDCS; (long-term) 1 week post sham tDCS","Serial Reaction Time task: General Learning Effect (during and following active tDCS), The Serial Reaction Time task (SRT-task) will be employed, using E-Prime® software. In the SRT-task, typically, reaction times (RTs) decrease with practice, which is referred to as a general learning effect and constitutes the non-sequence-specific learning component of IMSL., Changes in General Learning Effect will be assessed between: (baseline) during active tDCS; (short-term) 5-minutes post active tDCS; (long-term) 1 week post active tDCS|Serial Reaction Time task: General Learning Effect (during and following sham tDCS), The Serial Reaction Time task (SRT-task) will be employed, using E-Prime® software. The SRT- task will be performed on a laptop using E-Prime® software. In the SRT-task, typically, reaction times (RTs) decrease with practice, which is referred to as a general learning effect and constitutes the non-sequence-specific learning component of IMSL., Changes in General Learning Effect will be assessed between: (baseline) during sham tDCS; (short-term) 5-minutes post sham tDCS; (long-term) 1 week post sham tDCS",,Vrije Universiteit Brussel,,ALL,"ADULT, OLDER_ADULT",NA,30,OTHER,INTERVENTIONAL,"Allocation: RANDOMIZED|Intervention Model: CROSSOVER|Masking: DOUBLE (PARTICIPANT, CARE_PROVIDER)|Primary Purpose: TREATMENT",B1432020000012,2020-10-11,2022-08-31,2022-08-31,2020-10-28,,2022-05-02,"Vrije Universiteit Brussel, Brussels, Brussel, 1050, Belgium",
NCT00586079,Deep Brain Stimulation in Patients With Parkinson's Disease,https://clinicaltrials.gov/study/NCT00586079,,COMPLETED,The purpose of this study is to determine the effect of deep brain stimulation surgery on movement-related cortical potentials in patients with Parkinson's disease.,NO,Parkinson's Disease,PROCEDURE: Deep brain stimulation surgery.,"The primary measures are six EEG bereitschaftspotential areas and amplitudes., 12 months","Unified Parkinson's disease rating scale score., At time of EEG measurement.",,Mayo Clinic,,ALL,"ADULT, OLDER_ADULT",NA,20,OTHER,INTERVENTIONAL,Allocation: NON_RANDOMIZED|Intervention Model: PARALLEL|Masking: NONE|Primary Purpose: BASIC_SCIENCE,06-003248,2007-07,2011-06,2011-06,2008-01-04,,2016-03-18,"Mayo Clinic, Scottsdale, Arizona, 85259, United States",
NCT02052271,Experimental Therapeutics in Essential Tremor Using Cerebellar Transcranial Direct Current Stimulation,https://clinicaltrials.gov/study/NCT02052271,ELECTRE2,COMPLETED,The purpose of this study is to determine whether transcranial cathodal direct current stimulation (tDCS) delivered over the cerebellum can improve essential tremor.,NO,Essential Tremor,DEVICE: Cathodal cerebellar transcranial direct current stimulation,"Change from baseline in tremor amplitude on clinical rating scale, 10 minutes after the end of tDCS","Change from baseline in tremor amplitude on accelerometric recording, During tDCS, 10 mn, 60 mn and 90 mn after the end of tDCS|Change from baseline in tremor amplitude on electromyographic recordings, During tDCS, 10 mn, 60 mn and 90 mn after the end of tDCS|Change from baseline in tremor amplitude on digitized tablet, During tDCS, 10 mn, 60 mn and 90 mn after the end of tDCS|Change from baseline in tremor amplitude on clinical rating scale, During tDCS, 60 mn and 90 mn after the end of tDCS|Change from baseline of amplitude of motor evoked potentials elicited by TMS, 10 mn, 60 mn and 90 mn after tDCS",,"Institut National de la Santé Et de la Recherche Médicale, France",,ALL,"ADULT, OLDER_ADULT",NA,16,OTHER_GOV,INTERVENTIONAL,"Allocation: RANDOMIZED|Intervention Model: PARALLEL|Masking: TRIPLE (PARTICIPANT, INVESTIGATOR, OUTCOMES_ASSESSOR)|Primary Purpose: OTHER",C13-24|2013-A01404-41,2014-06-03,2018-03-27,2018-03-27,2014-02-03,,2020-02-13,"Institut du Cerveau et de la Moelle, Hôpital Pitié-Salpétrière, Paris, 75651, France",
