NCT Number,Study Title,Study URL,Acronym,Study Status,Brief Summary,Study Results,Conditions,Interventions,Primary Outcome Measures,Secondary Outcome Measures,Other Outcome Measures,Sponsor,Collaborators,Sex,Age,Phases,Enrollment,Funder Type,Study Type,Study Design,Other IDs,Start Date,Primary Completion Date,Completion Date,First Posted,Results First Posted,Last Update Posted,Locations,Study Documents
NCT04707378,Navigated Repetitive Transcranial Magnetic Stimulation for Parkinson's Disease With Depression or Cognitive Impairment,https://clinicaltrials.gov/study/NCT04707378,,UNKNOWN,"Depressive symptoms are common non-motor symptoms in patients with Parkinson's disease and seriously affect the quality of life and prognosis of patients. Currently, treatment measures for patients with Parkinson's disease with depression are mainly limited to pharmacotherapy, but the side effects of antidepressants and their interaction with anti-Parkinsonian drugs limit the use of pharmacotherapy. Repetitive transcranial magnetic stimulation (rTMS) is a new painless and non-invasive neuromodulation technique that is commonly used in the treatment of depression. As the number of people with Parkinson's disease increases in China, the number of patients with Parkinson's disease and depression requiring rTMS treatment will also increase. The size and shape of individual brains, the distance between the stimulation coil and the responding neuronal tissue, and the location and orientation of anatomical structures are all different, and the use of common localization methods is usually limited by these individual anatomical differences. The traditional method relies on manual positioning of the coil, which is time-consuming and inefficient, and it is difficult to meet the requirements of position, angle, and coil orientation simultaneously. Studies have shown that the benefits of using navigation for rTMS treatment are up to twice as high as those of non-navigation methods. Therefore precise localization is a must for the future standardized application of rTMS in the development of patients with Parkinson's disease with depression. In this study, we applied repetitive transcranial magnetic stimulation with neuronavigation to treat patients with Parkinson's disease and depression, and reconstructed cephalometric models with individual cranial imaging data to individualize and precisely target stimulation sites, making rTMS more precise and effective in treating patients with Parkinson's disease and depression, and providing new avenues for further clinical and scientific research.",NO,Parkinson Disease|Depression|Cognitive Impairment,DEVICE: repetitive transcranial magnetic stimulation(rTMS),"Hamilton Depression Scale（HAMD）, The Hamilton Depression Rating Scale (HAMD) is a 24-item interviewer administered structure questionaire designed to assess symptoms of depression. Items are scored with a range of 0-4, though 11 of the items are scored between 0 and 2. A total score is then calculated of all items which can range from 0 to 74. A higher score is indicative of more depressive symptoms, and a lower score post-tx is indicative of better outcome., 1 months|Beck Depression Inventory（BDI）, The Beck Depression Inventory (BDI) is a 21-item self-report questionaire that measures depressive symptoms. Each item is scored on a scale of 0-3, and items are summated to yield a total score. A higher score is indicative of greater symptoms of depression. Total scores may range between 0 and 63. A score greater than or equal of 14 is suggestive of clinically significant symptoms., 1 months","Hamilton Anxiety Scale（HAMA）, The Hamilton Anxiety Rating Scale (HAMA) is a designed to assess symptoms of anxiety. Items are scored with a range of 0-4. A total score is then calculated of all items which can range from 0 to 54. A higher score is indicative of more anxiety symptoms, and a lower score post-tx is indicative of better outcome., 1 months|Beck Anxiety Inventory（BAI）, The Beck Anxiety Inventory (BAI) is a 21-item self-report questionaire that measures Anxiety symptoms. Each item is scored on a scale of 0-3, and items are summated to yield a total score. A higher score is indicative of greater symptoms of anxiety. Total scores may range between 0 and 63. A score greater than or equal of 8 is suggestive of clinically significant symptoms., 1 months|Mini-mental State Examination（MMSE）, The MMSE consists of 2 parts: language (time orientation (5 items), registration and attention) and performance (recall, response to written/verbal commands, sriting ability and reproduction of complex polygons); the total score can range from 0 to 30, with a higher score indicating better function. A positive change score indicates improvement from baseline., 1 months|Montreal Cognitive Assessment Scale（MoCA）, The MoCA explores 8 cognitive domains: visuospatial/executive (score range form 0 to 5), naming(0-3), attention (0-5), language (0-3), abstraction(0-2), delayed recall(0-5), and orientation(0-6). The MoCA score was not corrected according to education level as advised by Gagnon and colleagues (2013). Its normal value was≥26 as proposed. A lower score indicates more severe cognitive impairment., 1 months|Named test of the Aphasia Battery of Chinese, The Aphasia Battery of Chinese(ABC) was compiled by Surong Gao et al in 1988 in accordance with the basic principles of aphasia inspection.It is mainly based on the Western Aphasia Battery (WAB), which has been developed through exploration and modification in combination with Chese national conditions and clinical experience.The named test is one of the subtest of the ABC.A total score is then calculated of all items which can range from 0 to 82. A higher score is indicative of worse outcome., 1 months|Similarity test, The similarity test includes 13 items scored with a range of 0-2. In each item, participants are given two words or concepts and have to describe how they are similar. A lower score indicates more severe abstract verbal reasoning and semantic knowledge impairment., 1 months|Symbol Digit modalities test（SDMT）, The Symbol Digit modalities test（SDMT) consists of nine digit-symbol pairs followed by a list of digits. Under each digit the subject should write down the corresponding symbol as fast as possible. The number of correct symbols within the 90 sec is measured., 1 months|Verbal fluency test（VFT）, The verbal fluency test is a kind of psychological test in which participants have to produce as many words as possible from a category in a given time (usually 60 seconds). A 60-second limit for responses within each category was allowed. Higher scores represent better performance., 1 months|Logical memory test（LMT）, The Logical Memory, subtest of the WMS-R is a standardized assessment of narrative episodic memory. A short story is orally presented, and the examinee is asked to recall the story immediately., 1 months|Delayed memory test（DMT）, Approximately 5 and 30 min later of the Logical memory test, recall of the story is again elicited, which is called delayed memory test., 1 months|Digit span test（DST）, In digit span test, participants must recall a series of numbers in order. A lower score indicates more severe working memory, attention, encoding and auditory processing impairment., 1 months|Ten point clock test, The ten point clock test is a reliable test of cognitive function. A total score is then calculated of all items which can range from 0 to 10. A higher score is indicative of better outcome., 1 months|Uniform Parkinson's Disease Rating Scale Ⅲ（UPDRSⅢ）, The motor section of the Unified Parkinson Disease Rating Scale (UPDRSⅢ) is covers the motor evaluation of disability and includes ratings for tremor, slowness (bradykinesia), stiffness (rigidity), and balance; part IV covers a number of treatment complications including ratings of involuntary movements (dyskinesias), painful cramps (dystonia), and irregular medication responses (motor fluctuations). It consists of 27 items, each are scored with a range of 0-4, with total score ranges from 0 to108. A higher score is indicative of more severe motor symptoms., 1 months|Modified Hoehn & Yahr scale（H-Y）, The Hoehn\&Yahr scale is a commonly used system for describing how the symptoms of Parkinson's disease progress. It was originally published in 1967 in the journal Neurology by Melvin Yahr and Margaret Hoehn and included stages 1 through 5. Since then, a modified Hoehn\&Yahr scale was proposed with the addition of stages 1.5 and 2.5 to help describe the intermediate course of the disease. A higher score is indicative of more severe movement impairment., 1 months|Activity of Daily Living Scale（ADL）, ADL was developed by Lawton and Brody in 1969.It consists of Physical self-maintenance Scale (PSMS) and Instrumental Activities of Daily Living Scale (IADL).It is mainly used to assess the daily life ability of the subjects. The total score below 14 points is indicative normal.More than 16 points is indicative functional decline.The highest score is 56., 1 months|Parkinson's Disease Questionnaire（PDQ-39）, The Parkinson's Disease Questionnaire is designed to address aspects of functioning and well-being for those affected by Parkinson's disease. Substantial evidence is available to suggest that the PDQ is reliable, valid, responsive, acceptable and feasible as the tool for the assessment of quality of life in Parkinson's disease patients. There are 39 questions in the long form Parkinson's Disease Questionnaire, with 8 discrete scales:mobility (10 items),activities of daily living (6 items),emotional well-being (6 items),stigma (4 items),social support (3 items),cognitions (4 items),communication (3 items),bodily discomfort (3 items) . Items are scored with a range of 0-4. A total score is then calculated of all items which can range from 0 to 156. A higher score is indicative of worse outcome., 1 months|Pittsburgh Sleep Quality Index (PSQI), The Pittsburgh Sleep Quality Index (PSQI) is an effective instrument used to measure the quality and patterns of sleep in adults. It differentiates ""poor"" from ""good"" sleep quality by measuring seven areas (components): subjective sleep quality, sleep latency, sleep duration, habitual sleep efficiency, sleep disturbances, use of sleeping medications, and daytime dysfunction over the last month. A total score is then calculated of all items which can range from 0 to 21. A higher score is indicative of worse outcome., 1 months|Epworth Sleepiness Scale (ESS), The Epworth sleepiness scale (ESS) is a self-administered questionnaire that's routinely used to assess daytime sleepiness. The person filling in the questionnaire rates how likely they are to doze off during the day in different situations. Each of the activities listed has an assigned score from 0 to 3 that indicates how likely a person is to fall asleep during the activity, and the total score can range from 0 to 24. A higher score is associated with increased sleepiness., 1 months|Parkinson's Disease Sleep Scale (PDSS-2), The Parkinson's Disease Sleep Scale (PDSS-2) allows people with Parkinson's Disease to self-rate and quantify the level of sleep disruption being experienced. Each of the sleep disruption listed has an assigned score from 0 to 4 that indicates the sleep disruption frequency within a week, and the total score can range from 0 to 60. A higher score is associated with increased sleep disruption., 1 months",,Guangdong Provincial People's Hospital,,ALL,"ADULT, OLDER_ADULT",NA,42,OTHER,INTERVENTIONAL,"Allocation: RANDOMIZED|Intervention Model: PARALLEL|Masking: QUADRUPLE (PARTICIPANT, CARE_PROVIDER, INVESTIGATOR, OUTCOMES_ASSESSOR)|Primary Purpose: TREATMENT",GDREC2020181H(R1),2020-12-30,2021-12-31,2021-12-31,2021-01-13,,2021-01-13,"Guangdong Provincial People's Hospital, Guangzhou, Guangdong, 510080, China",
NCT05580302,Cortical Silent Period in Laryngeal Dystonia,https://clinicaltrials.gov/study/NCT05580302,cSPDystonia,RECRUITING,"The goal of this observational study is to evaluate the cortical silent period (cSP) in cricothyroid muscle (CT) in laryngeal dystonia and control healthy subjects. The study will provide norms related to latency and amplitude of motor evoked potentials (MEPs) and duration of cSP in CT muscle in laryngeal dystonia and control healthy subjects.

Findings may give a baseline in comparison to findings in laryngeal diseases and insight into maladaptive cortical control function during phonation in laryngeal diseases like laryngeal dystonia.",NO,Laryngeal Dystonia|Spasmodic Dysphonia,OTHER: Transcranial Magnetic Stimulation (TMS),"Motor evoked potential (MEP) latency, MEP latency is expressed in milliseconds, MEP latency evaluated on the first day of the arrival on TMS experiment|Motor evoked potential (MEP) amplitude, MEP amplitude is expressed in microvolts, MEP amplitude evaluated on the first day of the arrival on TMS experiment|Duration of cortical silent period (cSP), cSP is expressed in milliseconds, cSP duration evaluated on the first day of the arrival on TMS experiment",,,"University of Split, School of Medicine",University Hospital of Split,ALL,"CHILD, ADULT, OLDER_ADULT",,20,OTHER,OBSERVATIONAL,Observational Model: |Time Perspective: p,003-08/22-03/0003,2022-10-10,2024-12,2025-12-31,2022-10-14,,2023-10-02,"University of Split School of Medicine, Split, 21000, Croatia",
NCT01567332,Evaluation of Walking After Repetitive Transcranial Magnetic Stimulation (rTMS) Inhibitory 1Hz in Vascular Hemiplegia,https://clinicaltrials.gov/study/NCT01567332,rTMS,TERMINATED,"Recovery of neurological deficits after stroke results from a reorganization of cortical activities, possibly through brain plasticity. Repetitive Transcranial Magnetic Stimulation (rTMS-MagproR30) produces changes in cortical excitability, generates phenomena of neuroplasticity. Its use to improve function after stroke, particularly of the upper limb, was validated. The investigators propose to evaluate in a prospective pilot against placebo, the benefit of rTMS at low frequency (1Hz) on the unaffected hemisphere in the short and medium term, especially on walking function and spasticity in patients with sequelae of cerebral infarction in the MCA territory with gait disturbance and motor weakness of the upper limb.",NO,Hemiplegia,DEVICE: SHAM - MagproR30 - DGM-512 - 9016E0741 - Tonika elektronics A/S - Active coil|DEVICE: SHAM inactive - MagproR30 - DGM-512 - 9016E0741 - Tonika elektronics A/S - Inactive coil,"Spontaneous walking speed of 10 meters. The evaluation of the primary endpoint is blind to the stimulation, Spontaneous walking speed (comfortable) to 10 meters. The gain on the walking speed of 10 meters will be appreciated by an independent evaluator, blinded to randomization.

The evaluation will be made on day 1 pre (T0) and post-stimulation (T1) (for 6 hours before and after 1 h), at D8 (T2) and J21 (T3) for 2 sessions (sham and active) ., 3 months","Distance covered in 6 min, 3 months|- Study of the march by AQM (Gait Deviation Index), Measurement parameters spatiotemporal, kinematic and kinetic walking on day 1 pre-test, J8, J21 of the two phases.

This measurement is performed using 4 cameras and markers installed in the room where runs quantified analysis of the march.

Patients are fitted with reflective markers so that their movements are recorded and then digitized, 3 months|- Consequence of lower limb spasticity (Modified Ashworth Scale of the quadriceps and triceps surae), Used to describe a subjective rate of increase in resistance or tone perceived by an examiner when a member engages in the mobility sector. Coast of the score 0-4 (0 no strength, no mobility possible, 4). The scale is used to measure the first tone. Its reproducibility is quite low but it is the scale used and accepted. It is brief and feasible (no equipment, but requires training).Will be measured pre and post test J1, J8 and J21 of the two phases., 3 months|Analytical and functional recovery of the lower limb (Fugl-Meyer Scale, the FIM score), The scale sensorimotor Fugl-Meyer: widely used in the literature, gold standard. The evolution motor is well defined. First part to obtain three subscores: MS (33 items, side 0 to 66), MI (17 items sides from 0 to 34), equilibrium (7 items sides from 0 to 14). The score can be used in total or subgroup. It requires 30 to 45 minutes with a trained evaluator. It can easily be used in clinical practice. A change in score \<10 may be due to simple measurement error and may not reflect a significant change in motor skills.

Will be measured pre and post test J1, J8 and J21 of the two phases., 3 months|Analytical and functional recovery of upper limb (Fugl-Meyer score and French arm test), The Frenchay Arm Test: This test, rapid (5 min) includes five tasks rated 0 or 1, requiring the use of one or both hands: draw a line, then install a lift cylinder, lift and then rest a glass of water, remove and replace a clothespin and combing. The score ranges from 0 to 5. The FAT is used to evaluate both the proximal motor skills, manual dexterity and bimanual coordination. It is validated in hemiplegic, reproduced over time and between observers, but its ceiling and floor effects are very important. Will be measured pre and post test J1, J8 and J21 of the two phases., 3 months|Patient satisfaction and quality of life on a visual analog scale and the SF 36., Is a generic health scale created to measure health status in the general population. It includes 36 items organized into eight dimensions, physical functioning, physical limitations, pain, social functioning, mental health, emotion, vitality, general health perceptions. It includes two questions to estimate the change of health status on the past four weeks. The test is validated, it is a simple questionnaire and short of 10 minutes (acceptability).It requires no training to administer. It can be done by mail (Feasibility).She will be provided on D8 of the two phases., 3 months",,Nantes University Hospital,,ALL,"ADULT, OLDER_ADULT",NA,10,OTHER,INTERVENTIONAL,"Allocation: RANDOMIZED|Intervention Model: CROSSOVER|Masking: DOUBLE (PARTICIPANT, INVESTIGATOR)|Primary Purpose: ",BRD/10/04-P,2011-09,2012-03,2012-03,2012-03-30,,2016-08-08,"Dr Angelique STEFAN, Nantes, 44000, France",
NCT04222218,Cerebellar rTMS Theta Burst for Postural Instability in Progressive Supranuclear Palsy,https://clinicaltrials.gov/study/NCT04222218,CerTI-PSP,COMPLETED,"Objective of the study:

To test the efficacy of theta burst cerebellar stimulation on postural instability in progressive supranuclear palsy using a cross-over design and wearing sensors technology

Design:

Twenty probable PSP patients with no dementia and still able to walk will be recruited for a cross-over sham-controlled study. Each patient will undergo a sham stimulation or a single session of cerebellar theta burst stimulation with a wash out period of at least 14 days.

Each patient will be evaluated before and after stimulation by berg balance tests (BBS), Tinetti scale, PSP-rating scale (PSP-RS), and a battery of gait and movement tests.

Static balance was assessed by 30-seconds-trials in semitandem and tandem positions with eyes open and closed using wearing sensors technology.",NO,"Progressive Supranuclear Palsy|Fall|Gait, Rigid|Parkinsonism",DEVICE: repetitive transcranial magnetic stimulation,"Short Physical Performance Battery, total time (SPPB), The short Physical performance battery included a walking test at convenient speed, a chair-rise test at convenient speed and tests of static balance including feet together, semi-tandem and tandem stance), Changes from Baseline to immediately after stimulation|Timed up and Go tests, total time (TUG), The time of performance of two timed up and go test ( one starting with the right foot, one starting with the left foot) will be assessed, Changes from Baseline to immediately after stimulation|Static Balance tests, total time, The assessment of static balance will include four tasks, in which the patient has to stand alone and maintain the position in different conditions for up to 30 seconds: tandem and semitandem positions with eyes closed and eyes open, respectively.

The time of performance without falling will be assessed., Changes from Baseline to immediately after stimulation|Tinetti Balance test (TBT), Assessment of postural instability (0-28, higher scores indicate better performances), Changes from Baseline to immediately after stimulation|Static Balance- area of sway, The area of sway during the postural instability tasks will be assessed (unit of measure mm2), Changes from Baseline to immediately after stimulation","PSP rating scale (PSP-RS), Assessment of postural instability and disability of patients (scores ranging from 0 to 100, lower scores indicate less disability), Changes from Baseline to immediately after stimulation|Static Balance: wearable sensor analyses - velocity, the velocity of sway will be assessed during the postural instability tasks (unit of measure (mm/s), Changes from Baseline to immediately after stimulation|Static Balance: wearable sensor analyses - acceleration, the acceleration of sway will be assessed during the postural instability tasks (unit of measure mm2/s), Changes from Baseline to immediately after stimulation|Static Balance: wearable sensor analyses - jerk, The time-derived of acceleration of sway will be assessed during the postural instability tasks (unit of measure mm3/s), Changes from Baseline to immediately after stimulation",,Fondazione Europea di Ricerca Biomedica Ferb Onlus,"University of Brescia, Neurology Department|University of Kiel, Neurogeriatric Department",ALL,"ADULT, OLDER_ADULT",NA,20,OTHER,INTERVENTIONAL,"Allocation: RANDOMIZED|Intervention Model: CROSSOVER|Masking: DOUBLE (PARTICIPANT, INVESTIGATOR)|Primary Purpose: TREATMENT",191201,2017-06-01,2019-11-01,2019-11-15,2020-01-09,,2020-01-22,"Parkinson's disease Rehabilitation Centre - FERB ONLUS, Trescore Balneario, Italy",
NCT01894802,Cortical Recording and Stimulating Array Brain-Machine Interface,https://clinicaltrials.gov/study/NCT01894802,CRS-BMI,RECRUITING,The purpose of this research study is to demonstrate the safety and efficacy of using two CRS Arrays (microelectrodes) for long-term recording of brain motor cortex activity and microstimulation of brain sensory cortex.,NO,Tetraplegia|Spinal Cord Injury|Brainstem Stroke|Brachial Plexus Injury|Above Elbow Amputation,DEVICE: Implantation of CRS Arrays,"The primary outcome is the safety of the participant., This measure will be considered a success if the device is not removed for safety reasons during the 12-month post-implant evaluation., One year following array implantation","The secondary outcome is the efficacy of the electrodes for long-term recording of neural activity and successful control of external devices., The efficacy of the CRS Arrays will be determined through a variety of measures, including characterization of signal quality, degrees of freedom achieved and subject performance., One year following array implantation",,Michael Boninger,University of Chicago|Carnegie Mellon University|Northwestern University,ALL,"ADULT, OLDER_ADULT",NA,30,OTHER,INTERVENTIONAL,Allocation: NA|Intervention Model: SINGLE_GROUP|Masking: NONE|Primary Purpose: OTHER,STUDY19100269,2013-12-01,2025-08,2026-12,2013-07-10,,2023-10-26,"University of Pittsburgh, Pittsburgh, Pennsylvania, 15213, United States",
NCT00001258,Studies of Frontal Lobe Brain Functioning in Schizophrenia,https://clinicaltrials.gov/study/NCT00001258,,COMPLETED,"The purpose of this study is to use brain imaging technology to investigate the role of the frontal lobe of the brain in the thinking of individuals with schizophrenia and other neuropsychiatric disorders and healthy volunteers.

Participants in this study will undergo a positron emission tomography (PET) scan of the brain while performing neuropsychological tests. Some of the tests involve cognitive operations that depend upon the frontal cortex. Interactions between frontal lobe activation, cognitive behavior, and neuropharmacology will be assessed by measuring regional cerebral blood flow (rCBF) during treatment with drugs that may affect frontal lobe physiology.",NO,Healthy Subjects|Schizophrenia|Parkinson Disease,DRUG: Oxygen-15 Water,"Differences between rCBF during the frontal lobe tasks and rCBF during the sensorimotor control, ongoing, ongoing",,,National Institute of Mental Health (NIMH),,ALL,"ADULT, OLDER_ADULT",,1039,NIH,OBSERVATIONAL,Observational Model: |Time Perspective: p,900014|90-M-0014,1993-11-26,,,1999-11-04,,2024-01-30,"National Institutes of Health Clinical Center, Bethesda, Maryland, 20892, United States",
