NCT Number,Study Title,Study URL,Acronym,Study Status,Brief Summary,Study Results,Conditions,Interventions,Primary Outcome Measures,Secondary Outcome Measures,Other Outcome Measures,Sponsor,Collaborators,Sex,Age,Phases,Enrollment,Funder Type,Study Type,Study Design,Other IDs,Start Date,Primary Completion Date,Completion Date,First Posted,Results First Posted,Last Update Posted,Locations,Study Documents
NCT01113086,Use of Noninvasive Brain Stimulation in Parkinson's Disease,https://clinicaltrials.gov/study/NCT01113086,,COMPLETED,"The purpose of this research is to determine whether repetitive sessions of transcranial direct current stimulation (tDCS) to the prefrontal cortex can enhance the cognitive, affective and motor functioning of those with Parkinson's Disease.

In this study we will compare active tDCS with sham tDCS. Each subject will receive two consecutive weeks of stimulation (Monday through Friday). A battery of neuropsychological and affective tests will be administered throughout the duration of the study.",NO,Parkinson's Disease,DEVICE: Transcranial direct current stimulation,"Evidence of improvement in general motor functioning in patients with Parkinson's., Measured by various indexes, including Unified Parkinson's Disease Rating Scale (UPDRS), Simple Reaction Time, 4-Choice Reaction Time, Purdue Pegboard Test, Finger tapping, walking time, buttoning up and supination-pronation., after treatment (10 days) and at follow up (1 and 2 months after final stimulation)","Evidence of improvement in cognitive functioning in the areas of: executive function, reasoning, visuospatial ability, and working memory for patients with Parkinson's., Will be measured by The Stroop Test, Hooper Visual Organization Test, Digit Span Test, Trail Making Test B., after treatment (10 days) and at follow up (1 and 2 months after final stimulation)",,Spaulding Rehabilitation Hospital,,ALL,"ADULT, OLDER_ADULT",NA,12,OTHER,INTERVENTIONAL,"Allocation: RANDOMIZED|Intervention Model: CROSSOVER|Masking: DOUBLE (PARTICIPANT, OUTCOMES_ASSESSOR)|Primary Purpose: BASIC_SCIENCE",2009-P-001806,2009-12,2013-03,2013-03,2010-04-29,,2020-04-24,"Spaulding Rehabilitation Hospital, Boston, Massachusetts, 02114, United States|Berenson Allen Center for Noninvasive Brain Stimulation, Boston, Massachusetts, 02125, United States",
NCT00753519,Transcranial Magnetic Stimulation to Treat Parkinson's Disease,https://clinicaltrials.gov/study/NCT00753519,,COMPLETED,"This study will look at the effects of transcranial magnetic stimulation (TMS) on symptoms of Parkinson's disease. TMS is a method of brain stimulation that may be able to change the activity of the nerve cells of the brain. This study will examine the effects of a specific pattern of stimulation called intermittent theta-burst TMS (iTBS), which uses repeated magnetic pulses delivered in short bursts.

People with mild to moderately severe Parkinson's disease who are between 40 and 80 years of age and whose main problems are slow movement and stiffness may be eligible for this study.

Participants undergo the following tests and procedures:

* Random assignment to real or placebo (sham) iTBS treatment.
* iTBS sessions (real or sham) 4 times a week for 2 consecutive weeks. For this test, the subject sits in a comfortable chair. A wire coil is held on the subject's scalp, and a brief electrical current is passed through the coil, creating a magnetic pulse that stimulates the brain. The subject hears a click and may feel a pulling sensation on the skin under the coil. There may be a twitch in the muscles of the face, arm or leg.
* Test of gait (walk), hand and arm movements before and after each session. The gait test requires walking 10 meters (about 30 yards) in the same corridor with the same shoes.
* Extended testing. The first and last gait tests (done before starting iTBS and after the eighth session) require coming off any Parkinson's medication for at least 12 hours before the test. On these test days, subjects also undergo a clinical examination, short neuropsychological test battery, a computer-based reaction time test and depression and quality-of-life rating scales. These procedures are repeated in a follow-up visit 1 month after the last session.",YES,Parkinson Disease,DEVICE: Real iTBS|DEVICE: Sham iTBS,"Gait Speed, Gait speed was assessed by measuring the time it takes to walk 10 meters. Subject's gait speed was measured while on medication and off medication for each group, i.e., real iTBS and sham iTBS. Two trials were averaged for each condition. Patients were instructed to walk fast without taking the risk of falling, wearing the same shoes and consistently using assistive devices if needed. Gait speed was measured at baseline, 1 day post intervention, and 1 month post intervention., baseline, 1 day post iTBS","Bradykinesia, Bradykinesia refers to the slowness in executing a movement. Bradykinesia was assessed by measuring the time in seconds it takes to do the following sequence, 10 times: 1) hand closing and opening while squeezing a ball 2) elbow flexion 3) hand closing and opening, and 4) elbow extension. Subjects were allowed to practice these hand and arm movements until performance appeared not to get faster, and then were abstained from further practice to minimize learning effects. The time it takes subjects to execute the entire sequence 10 times with either the left or right arm/hand was measured. Means are reported for each group., baseline, 1 day post iTBS|Total UPDRS Score, The Total Unified Parkinson's Disease Rating Scale (UPDRS) is an overall assessment scale that quantifies the signs and symptoms of Parkinson's disease. The total UPDRS score consists of mentation, behavior, mood, activities of daily living and motor components, and ranges from 0 (not affected) to 176 (most severely affected). The total UPDRS score is obtained from patient examination, interview and patient questionnaires., baseline, 1 day post iTBS|Motor UPDRS, The Motor Unified Parkinson's Disease Rating Scale (UPDRS) includes only the motor assessment of the UPDRS (Part III) and examines speech, facial expression, tremor at rest, action tremor, rigidity, finger taps, hand movements, hand pronation and supination, leg agility, arising from chair, posture, gait, postural stability and body bradykinesia. The scores range from 0 (no motor impairment) to 108 (severe motor impairment)., baseline, 1 day post iTBS",,Mark Hallett,National Institute of Neurological Disorders and Stroke (NINDS),ALL,"ADULT, OLDER_ADULT",PHASE1|PHASE2,28,NIH,INTERVENTIONAL,"Allocation: RANDOMIZED|Intervention Model: PARALLEL|Masking: DOUBLE (PARTICIPANT, OUTCOMES_ASSESSOR)|Primary Purpose: TREATMENT",080212|08-N-0212,2008-09,2009-09,2009-09,2008-09-16,2012-08-31,2012-11-15,"National Institutes of Health Clinical Center, 9000 Rockville Pike, Bethesda, Maryland, 20892, United States",
NCT01968512,Neurobiological Aspects of the Attention Deficit Hyperactivity Disorder,https://clinicaltrials.gov/study/NCT01968512,NAADHD,COMPLETED,Evaluating neurobiological disorder associated with Attention Deficit Hyperactivity Disorder (ADHD) and the contribution of transcranial direct current stimulation (tDCS) in the adaptation of inhibitory control.,NO,Attention Deficit Hyperactivity Disorder,DEVICE: Transcranial Direct Current Stimulation|DEVICE: Sham,"Quantitative electroencephalography, Quantitative electroencephalography to assess the neurobiological aspects evidenced by the amount of brain electrical activity observed by the amplitude of waves through graphs., During the only day of the assessment, we will do it before (during 8 minutes) and after (during 8 minutes more) tDCS","Functional Brain Network, Functional Brain Network based on the quantitative EEG data through computational and mathematical modeling. During the only day of the assessment, we will do it before (we will get this information from EEG recording during 8 minutes before do the stimulation) and after tDCS(we will get this information from EEG recording during 8 minutes after the stimulation)., During the only day of the assessment, we will do it before and after tDCS","Go/No Go test, Neuropsychological test to assess the adequacy of inhibitory control. During the only day of the assessment, we will do it before (after 5 minutes of EEG recording, we will start the Go/No go test keeping the EEG recording for 3 minutes, and after it we will do tDCS) and after the tDCS (after 5 minutes of EEG recording, we will restart the Go/No go test keeping the EEG recording for 3 minutes)., During the only day of the assessment, we will do it before and after tDCS",Federal University of Bahia,,ALL,ADULT,NA,60,OTHER,INTERVENTIONAL,"Allocation: RANDOMIZED|Intervention Model: FACTORIAL|Masking: DOUBLE (PARTICIPANT, OUTCOMES_ASSESSOR)|Primary Purpose: TREATMENT",285.841,2013-10,2014-04,2014-04,2013-10-24,,2014-05-01,"Federal University of Bahia, Salvador, Bahia, 40000-000, Brazil",
NCT04361955,Modulatory Effects of Deep Brain Stimulation on Cerebral Cortical Activity,https://clinicaltrials.gov/study/NCT04361955,,COMPLETED,"The purpose of this study is to learn about how deep brain stimulation (DBS) affects brain activity in those with Parkinson's disease (PD) and essential tremor (ET). The effect of therapeutic and non-therapeutic stimulation settings will be assessed. Additionally, DBS effects in the presence and absence of anti-PD medication will be studied. Also of interest are differences in stimulation effects while at rest versus while performing a task.",NO,DBS|Parkinson Disease|Essential Tremor|Healthy,OTHER: EMG|OTHER: EEG,"characterize and record brain activity, 1) Characterize the spatial and temporal characteristics of cortical activity evoked in response to deep brain stimulation of the targeted subcortical nucleus. 2) Determine the effect of dopamine replacement therapy (DRT) on the spatial and temporal characteristics of the evoked cortical potentials (PD Patients only). 3) Determine the effect of patient state (rest vs. active) spatial and temporal characteristics of the evoked cortical potentials., collected during the 8 hour office visit",,,The Cleveland Clinic,Farmer Foundation,ALL,"ADULT, OLDER_ADULT",NA,66,OTHER,INTERVENTIONAL,Allocation: NON_RANDOMIZED|Intervention Model: PARALLEL|Masking: NONE|Primary Purpose: TREATMENT,20-028,2020-01-31,2023-08-10,2023-08-10,2020-04-24,,2024-01-08,"Cleveland Clinic, Cleveland, Ohio, 44195, United States",
NCT05678725,Transcranial Direct/ Alternating Current Stimulation for Parkinson's Disease Treatment,https://clinicaltrials.gov/study/NCT05678725,,COMPLETED,"To investigate the difference in the treatment efficacy between transcranial direct current stimulation and transcranial alternating current stimulation on Parkinson's disease, including the improvements in the motor, cognitive, and underlying neural mechanisms behind differences in efficacy by electroencephalography (EEG).",NO,Parkinson Disease|tACS|tDCS,DEVICE: tACS|DEVICE: tDCS|DEVICE: sham,"the changes in UPDRS III, Unified Parkinson´s Disease Rating Scale Section III-motor is the sum of 18 items, each item contains 0-4 ratings, where 0=normal, 1= slight, 2= mild, 3=moderate, 4=severe., pre-stimulation; post-stimulation (immediate after stimulation）|the changes in MoCA, Montreal Cognitive Assessment is a 30-question test to assess cognitive function. Lower scores mean a worse cognitive status., pre-stimulation; post-stimulation (immediately after stimulation)","simple reaction task, First , there was a fixation sign""+"" appearing on the screen for 0.5 s, then, after 2-5 seconds, a black dot would appear. Participants were instructed to press the space bar as fast as possible when the black dot appears in the center of the screen, to measure simple perception and sustained alertness. The changes in accuracy(ACC), reaction time(RT), and ACC/RT were calculated., pre-stimulation; post-stimulation (immediately after stimulation)|the changes in EEG power, EEG recording by 8 channels EEG device. The EEG power in alpha， beta， delta, and theta bands will be investigated, pre-stimulation; post-stimulation (immediately after stimulation)",,Anhui Medical University,,ALL,"ADULT, OLDER_ADULT",NA,80,OTHER,INTERVENTIONAL,"Allocation: RANDOMIZED|Intervention Model: PARALLEL|Masking: TRIPLE (PARTICIPANT, INVESTIGATOR, OUTCOMES_ASSESSOR)|Primary Purpose: TREATMENT",tAtDComparePD,2022-10-15,2022-12-15,2022-12-15,2023-01-10,,2023-01-10,"Anhui Medical University, Hefei, Anhui, 230032, China",
NCT05351255,Motor Learning After Cerebellar Damage: The Role of the Primary Motor Cortex,https://clinicaltrials.gov/study/NCT05351255,,ACTIVE_NOT_RECRUITING,"This study will determine (1) whether baseline inhibitory activity in the primary motor cortex can predict motor learning ability in individuals with cerebellar degeneration, and (2) whether modulating primary motor cortex activity with non-invasive brain stimulation alters motor learning ability in this population.",NO,Cerebellar Ataxia,DEVICE: Transcranial Magnetic Stimulation (TMS),"International Cooperative Ataxia Rating Scale Total Score, The sore out of 100 that results from assessment using the International Cooperative Ataxia Rating Scale (ICARS). The rating scale has a minimum score of 0 and a maximum score of 100. Higher scores indicate more severe impairment., Baseline|International Cooperative Ataxia Rating Scale Limb Coordination Sub-Score, The score out of 52 that results from assessment using the Limb Kinetic sub-section of the International Cooperative Ataxia Rating Scale (ICARS). The Limb Kinetic sub-score has a minimum score of 0 and a maximum score of 52. Higher scores indicate more severe impairment., Baseline|Reinforcement Learning Rate, The slope of the time series of reach path lengths (determined from digital 3D kinematic data recorded using a motion capture system) over the first 80 trials of the intervention phase of the reinforcement motor learning task., During the intervention, assessed up to 10 days|Total Reinforcement Learning, The difference in mean reach path length (determined from digital 3D kinematic data recorded using a motion capture system) between the baseline phase and the end of the intervention phase of the reinforcement motor learning task., During the intervention, assessed up to 10 days|Slope of the Corticomotor Excitability Recruitment Curve, The slope of motor evoked potential amplitudes (determined from electromyographic recordings of target muscle activity) between TMS intensities of 120-140% of resting motor threshold., Baseline|Slope of the Short-Interval Intracortical Inhibition (SICI) Recruitment Curve, SICI will be computed as the difference in average motor evoked potential amplitude (determined from electromyographic recordings of target muscle activity) between a TMS condition where a single conditioning pulse is applied 3 ms before a single test pulse and a TMS condition where only the test pulse is applied. A range of conditioning pulse TMS intensities will be tested and SICI will be measured for each. The outcome measure comprises the slope of the SICI values over each conditioning pulse intensity., Baseline|Cortical Silent Period, Single pulses of TMS will be applied at an intensity of 110% of resting motor threshold while participants tonically activate the target muscle at 20% of their maximum voluntary isometric contraction. 12 repetitions of the protocol will be performed. The outcome measure comprises the average time, in ms, from the end of the motor evoked potential to the reoccurrence of tonic background electromyographic activity., Baseline",,,Albert Einstein Healthcare Network,Medical University of South Carolina,ALL,"ADULT, OLDER_ADULT",NA,12,OTHER,INTERVENTIONAL,Allocation: NA|Intervention Model: SINGLE_GROUP|Masking: NONE|Primary Purpose: BASIC_SCIENCE,AEHN-IRB-2022-881,2022-07-01,2024-08-31,2025-08-30,2022-04-28,,2023-08-02,"Moss Rehabilitation Research Institute, Elkins Park, Pennsylvania, 19027, United States",
NCT00411255,Brain Stimulation to Treat Blepharospasm or Meige Syndrome,https://clinicaltrials.gov/study/NCT00411255,,COMPLETED,"This research study will examine whether magnetic or electrical stimulation of the brain can improve the involuntary closure of the eyelids in patients with blepharospasm or Meige syndrome; conditions that belong to a group of neurological disorders called dystonias. Blepharospasm and Meige syndrome cause excessive involuntary closure of the eyelids or blinking. In an earlier study of patients with writer's cramp, which is another form of dystonia, symptoms improved temporarily with brain stimulation.

Interested people 18 years of age or older with blepharospasm or Meige syndrome may be eligible for this study. Candidates are screened with a medical history, physical examination and a blink reflex test.

Participants undergo brain stimulation and evaluations before and after the stimulation to test the response, as follows:

Procedures

* Transcranial magnetic stimulation (TMS): A wire coil is held on the patient's scalp. A brief electrical current is passed through the coil, creating a magnetic pulse that stimulates the brain. The subject hears a click and may feel a pulling sensation on the skin under the coil. There may be a twitch in the muscles of the face, arm or leg. The subject may be asked to tense certain muscles slightly or perform other simple actions. The effect of TMS on the muscles is detected with small metal disk electrodes taped to the skin of the arms or legs. TMS is done on eight of the ten test days.
* Repetitive TMS (rTMS): The same procedure as TMS, except repeated magnetic pulses are delivered in short bursts. RTMS is done on eight of the ten test days.
* Theta burst stimulation (TBS): A form of rTMS that involves short bursts of impulses. TBS is done on four study days.
* Cathodal transcranial DC stimulation (tDCS): Two conductive-rubber electrodes placed in saline-soaked sponges are positioned over two areas of the head. A constant weak electrical current flow is applied for 20 minutes. tDCS is done on two study days.

Evaluations

* Physician observation: The subject's eyes are videotaped for 5 minutes before and after each TMS session. A physician then counts how many times the subject blinked during the 5 minutes.
* Questionnaire: Subjects are asked to rate their symptoms before and after brain stimulation.
* Electrophysiological test of the blink reflex: Wires are taped to the skin on the nose and temple to record the eye movement during blinking. A thin plastic rod is placed on the skin over the right e...",NO,Blepharospasm|Focal Dystonia,PROCEDURE: repetitive transcranial magnetic stimulation (rTMS),,"Patient report the subject rating of their symptoms before and after intervention., Before, immediately after, and one hour after the intervention.",,National Institute of Neurological Disorders and Stroke (NINDS),,ALL,"ADULT, OLDER_ADULT",PHASE2,22,NIH,INTERVENTIONAL,Allocation: |Intervention Model: CROSSOVER|Masking: SINGLE (PARTICIPANT)|Primary Purpose: SUPPORTIVE_CARE,060192|06-N-0192,2006-06-22,2009-04-07,2009-04-07,2006-12-13,,2017-07-02,"National Institute of Neurological Disorders and Stroke (NINDS), 9000 Rockville, Bethesda, Maryland, 20892, United States",
NCT02441985,rTMS Therapy for Primary Orthostatic Tremor,https://clinicaltrials.gov/study/NCT02441985,,COMPLETED,"Primary orthostatic tremor(POT) is a rare progressive functionally disabling tremor disorder. The characteristic features of POT are symptoms of unsteadiness in legs reported by patients when they are standing and improvement of symptoms upon walking and sitting. Due to the limited success of other treatment options there is a clear merit in continuing efforts to explore and investigate novel treatment modalities. Transcranial magnetic stimulation (TMS) is a well-established physiological tool to understand brain function. When repetitious TMS pulses are delivered to a specific target at predefined stimulation parameters, it is referred to as rTMS therapy.The investigators propose a novel approach to investigate the clinical and physiological effects of low frequency rTMS therapy in POT. The overarching hypothesis of this study is that low frequency rTMS therapy delivered to the cerebellum will modulate the cerebellar excitability and result in clinical improvements.In order to determine the physiological effects related to rTMS, the tremor physiology will also be recorded with surface electromyography (EMG). The investigator will also record the changes in cerebellum excitability in response to rTMS using cerebello-cortical inhibition (CBI), a well-established TMS parameter.",NO,Primary Orthostatic Tremor,"DEVICE: Magstim RapidStim2|DEVICE: Sham Magstim RapidStim2|OTHER: Fahn-Tolosa-Marin Tremor Rating Scale (TRS)|OTHER: Timed ""Up & Go"" Test (TUG) test|OTHER: 10m walk test|OTHER: Tremor electrophysiology|OTHER: Cerebellar-brain Inhibition (CBI)","Fahn-Tolosa-Marin Tremor Rating Scale (TRS), Part A assesses examiner-reported tremor location/severity (amplitude), Part B assesses examiner-reported ability to perform specific motor tasks/functions (writing, drawing, and pouring with dominant and non-dominant hand), and Part C assesses patient-reported functional disability resulting from the tremor (speaking, eating, drinking, hygiene, dressing, writing, working, and social activities).All tremor items will be rated based on a scale of 0=none to 4=severe. Finally, the TRS includes one separate item dealing with global assessment of tremor-related disability, rated both by patient and examiner on a 5-point scale. For outcome analysis, total tremor score and leg tremor score (derived from leg motor item on the scale) will be recorded. For the outcome assessment the test will be videotaped and scored by a blind rater., Day 1|Timed ""Up & Go"" Test (TUG) test, The TUG is a mobility test that is used to measure the basic mobility skills and gait speed of people who have neurological conditions. It includes a sit-to-stand component as well as walking 3 m, turning, and returning to the chair. People perform these tasks using regular footwear and customary walking aids. The measured outcome is the time in seconds to complete the entire sequence. For the outcome assessment the test will be videotaped and scored by a blind rater., Day 1|10m walk test, In this test, subjects are instructed to walk 10m distance and timed. The speed of walking is determined as the distance covered (10m) divided by the amount of time needed to cover the distance. For the outcome assessment the test will be videotaped and scored by a blind rater., Day 1","Tremor electrophysiology, POT tremors will be recorded on the surface EMG for amplitude and power spectral frequency analysis. The investigator will use Bagnoli EMG system and Trigno wireless EMG system to record the surface EMG signals arising from muscles and the accelerometer findings respectively.Tremor amplitude and frequencies will be calculated with the surface EMG using Bagnoli system and accelerometry recorded using Trigno system., Day 1|TMS measure, Cerebellar inhibition (CBI) will be recorded which is a well-established TMS measure. A paired pulse protocol will be used with right cerebellar stimulation as the conditioning stimulus, (cerebellar conditioning stimulus or CCS) and left motor cortex stimulation (M1) as the test stimulus (TS). The investigator will determine the 'TS 0.5mV' which will indicate a stimulator setting (determined to the nearest 1% of the maximum stimulator output) that produces a peak-to-peak MEP amplitude of ≥0.5mV in at least five out of 10 trials. Interstimulus intervals (ISI) of 3 to 8 milliseconds at increment of 1 millisecond will be tested. Each run will consist of 10 trials of each of the paired stimuli (CCS-TS) and 10 trials of TS alone delivered in random order. Inhibition trial will be expressed as a ratio of mean conditioned to mean unconditioned MEP amplitude for each subject., Baseline to 60 Minutes",,University of Florida,National Organization for Rare Disorders|Neuronetics,ALL,"ADULT, OLDER_ADULT",NA,11,OTHER,INTERVENTIONAL,"Allocation: RANDOMIZED|Intervention Model: CROSSOVER|Masking: TRIPLE (PARTICIPANT, CARE_PROVIDER, OUTCOMES_ASSESSOR)|Primary Purpose: TREATMENT",IRB201500347,2015-08,2019-01-08,2019-01-08,2015-05-12,,2019-07-02,"Center for Movement Disorders and Neurorestoration, Gainesville, Florida, 32607, United States",
